7651b77724481811b967b36ec6d164119edcd5e1,ACCUMULO-3475,ACCUMULO-3475 Remove configError and use config(String...) retval
c6e771e9deda12ac664ba4650c8d798588c046b6,ACCUMULO-3474,ACCUMULO-3474 Fix bad merge.
cfb832a1f1d7fa975bd837fbdbdb152aba4cf050,ACCUMULO-3474,ACCUMULO-3474 use the value of the delete flag (with test)
2ca91038c9788ef156e8fcc35a224a125234728b,ACCUMULO-3472,ACCUMULO-3472 Avoid filesystem.equals as it isn't implemented
99011d3234c0649e2ae163e9ca3c6a449ffcdd0d,ACCUMULO-3002,ACCUMULO-3002 Ensure instance.volumes is not set during upgrade
02142ff4154e81d9d0e355470a9e0780c7c3ada0,ACCUMULO-3468,ACCUMULO-3468 Increase zk timeout in MonitorUtil.
3bf46661e2ab8680acfdec04ec1c4894e94c3206,ACCUMULO-2641,ACCUMULO-2641 Adding serialVersionUuid back into TInfo class
ade425862446e358a051190bac9cdc0bc2e80679,ACCUMULO-2641,ACCUMULO-2641 adds scan id as optional thrift parameter so that getActiveScans(tserver) getScanid() returns unique value with MAC test.
44ad36ca65a4fb222ade06981e0a63260a32b16f,ACCUMULO-3462,ACCUMULO-3462 stop the span during finally clause
34dda79f28810690df59643bd9534570d94439ed,ACCUMULO-3462,ACCUMULO-3462 stop the span during finally clause
b90b123e1a4dee6a5654ee9dffb3a2bb447a14c6,ACCUMULO-3462,ACCUMULO-3462 reduce the opportunity for the queued tablet to get mis-marked, merge to master
4468089772b08b5619aafd4ac95ea448a0ba3bb7,ACCUMULO-3462,ACCUMULO-3462 reduce the opportunity for the queued tablet to get mis-marked, merge to 1.6
07422efc5140e57735d22fe4df1d966095c4e172,ACCUMULO-3462,ACCUMULO-3462 reduce the opportunity for the queued tablet to get mis-marked
9022987e093842eb465113f5a3a80f3ef2855444,ACCUMULO-3461,ACCUMULO-3461 Fix race condition in ZooTraceClientTest
81d72b309b2815e1464bba6aad54ccbd412cec6e,ACCUMULO-3453,ACCUMULO-3453 Bump commons-io dependency from 2.1 to 2.4.
794e68cf70b5b86832ee0187749abbd7550096a1,ACCUMULO-3450,ACCUMULO-3450 Push audit configuration into Log4jConfiguration.
3bcc3c9ed78fa2444cc95911895e743d38ffc706,ACCUMULO-3446,ACCUMULO-3446 Fix compilation.
92551204eb040ff54b394a49eda1ad60712e516b,ACCUMULO-3448,ACCUMULO-3448 Break out to avoid the default case.
148e293acce79dcf02fe4bf13a221bf5881dd326,ACCUMULO-3448,ACCUMULO-3448 Break out to avoid the default case.
00d758d17aa380bf42a69bf2795aead6eced9a22,ACCUMULO-3441,ACCUMULO-3441 use the proper TServerStatus object to update current instances
7b894e72c9ee063fc80286a50258da55be1d0e16,ACCUMULO-3443,ACCUMULO-3443 Speicfy UTF-8 when comparing header bytes
9a32ec1169035e49f65ec919f0057a9672a975eb,ACCUMULO-2591,ACCUMULO-2591 Ensure binary compat of TeraSortIngest across Hadoop 1/2
59238d046a39a859a28bc1a0ea79b8a93156e554,ACCUMULO-3435,ACCUMULO-3435 Use RawLocalFileSystem
27d79c2651277c465a497c68ec238771692a6fa0,ACCUMULO-3438,ACCUMULO-3438 Log an error when AuthenticationToken converter fails.
0398fa70be7758279c61735435be4c67f96bb104,ACCUMULO-3291,ACCUMULO-3291 Use target instead of /tmp
6d8c8c71046b1cfb9163e29e6283927e50983625,ACCUMULO-3340,ACCUMULO-3340 prefer IPv4 for MAC processes
d2aeb5ef2443d3f320906f6d3fd99f60b5bd9d8a,ACCUMULO-3383,ACCUMULO-3383 Remove unused import
97f16db4d31db63b46985da07228b89f0c346270,ACCUMULO-3383,ACCUMULO-3383 Fix for AccumuloVFSClassloader conflicting cache directories
4bac748496df2f602a821dc0605fe4e4be9a6978,ACCUMULO-3172,ACCUMULO-3172 Remove -dirty flag on releases
8f4bc4c23a60ddef7eac5b20d6d08b2762931df1,ACCUMULO-3126,ACCUMULO-3126 Fix malformed package-info.java
52a6e977fa4f4fe89e90a0f0b44dc04ef9024bb0,ACCUMULO-3352,ACCUMULO-3352 Propagate bulk import errors to client
9f8f5882ee220e5b9caa20f98ca9d4e334ebb16a,ACCUMULO-3426,ACCUMULO-3426 return this in setDurability
27d4ee212984015acc53c4514bb053d3482240de,ACCUMULO-3424,ACCUMULO-3424 Remove requirement for properties on provided token.
e435611127905f924dab9a8fdcd36c4518871ba7,ACCUMULO-3421,ACCUMULO-3421 Retry initialization of trace client
80f44ad1bfddb3adc2f10b966028f6b86558c75e,ACCUMULO-3422,ACCUMULO-3422 Use the MAC's client configuration
a971489d4040526e5b4da0715b0265a75d128350,ACCUMULO-3408,ACCUMULO-3408 Fix whitespace complaints
5427a59048ece3f69a8d7a7a4d45cb4eb91b1e55,ACCUMULO-3419,ACCUMULO-3419 Fix testTrace in master
cabf265ae44d27120d13ceef13a030d7698c365f,ACCUMULO-3408,ACCUMULO-3408 fix many assumptions about NumberType, and move the class to the proper package
0abfa273de10c80580e1a0a27ed59bca117e8190,ACCUMULO-3419,ACCUMULO-3419 Quote the colvis and increase ZK client timeout
1a944c06c7b54cdca943d29af65bc8b4bf728128,ACCUMULO-3397,ACCUMULO-3397 decrease the percentage
81d25bc24b55b4418c0296de81cdf213ef7e8eac,ACCUMULO-3408,ACCUMULO-3408 fixed PreciseNumberType and wrote a unit test to make sure it really does precise numbers
9980d4ab9d70dead8377e413bb6dbccba9e5f9b8,ACCUMULO-3407,ACCUMULO-3407 fix unused import warning
16f1dbd8829da537a1bbd351523cc016be6fa1fc,ACCUMULO-3407,ACCUMULO-3407 keep less information in memory
0cbc8e5fdef161215867b3de1440b8e83327a4db,ACCUMULO-3406,ACCUMULO-3406 fix filename parsing
6170c02ee99bb5a03d83441a96882f5767b2bde2,ACCUMULO-3269,ACCUMULO-3269 Add a brief sleep before retrying ruok
8f4eae77d12e4b3a54ef2cd176c7cd26b2af326a,ACCUMULO-3269,ACCUMULO-3269 Set REUSEADDR on the Socket.
6289567062490574642c9004d6d0860545c632c2,ACCUMULO-3392,ACCUMULO-3392 Remove incorrect javadoc on MiniAccumuloCluster.start()
a3267d3e75ca55b6444cd294c78e55e19e252b43,ACCUMULO-3385,ACCUMULO-3385 Fix broken DateLexicoder ordering
1d288cfe5413fa45ca2710712b84cb2f84b5ecf8,ACCUMULO-3377,ACCUMULO-3377 Add exception to log message
7f20e6aef77f4fe60a93d06ee13e41d8585125cf,ACCUMULO-3372,ACCUMULO-3372 avoid holding the lock while constructing a cached object
211197ce590d802fb58d42d0204cc4db11c0ff03,ACCUMULO-3373,ACCUMULO-3373 Get thrift generation working again.
c41b6dc057a10926f40c387b733c751671103f80,ACCUMULO-3362,ACCUMULO-3362 Fix incorrect javadoc for StatsCombiner
ccc9a6788664b4ddce7ca207f0c24cf28b7b9c8b,ACCUMULO-3299,ACCUMULO-3299 Ensure tests run properly scoped
c5197aaf4dee8c4e6e05f446fa940c75cc923d43,ACCUMULO-3355,ACCUMULO-3355 Broke this IT in the process. Need to check a few times to give the tracer time to write to the table.
6166406f99430e509f1b66d8fc8e8f6a783b8f58,ACCUMULO-3351,ACCUMULO-3351 Remove use of deprecated trace code in 1.7.x
07e5e66c4ac5bf05c31fa9be961c6bc06fa3ce27,ACCUMULO-3358,ACCUMULO-3358 Start the verify thread.
0934298e09a2d311e7d9a9cd86b611f285f791b4,ACCUMULO-3355,ACCUMULO-3355 Catch the case when we find no traces and quit early.
32c18d59ffe3581134d6a0e6e83494fb979ee931,ACCUMULO-3351,ACCUMULO-3351 Try to reset the writer if we don't have one but the table exists.
7f8ef553da765221d714bece239d3294495fb79e,ACCUMULO-3341,ACCUMULO-3341 Make deletetable remove any tables in the accumulo namespace before attempting deletion.
4af9f85d4fc89929870959aac430f3a02c20f20b,ACCUMULO-3342,ACCUMULO-3342 Remove check for tracer in ZK
1835c27ca41426ddd570cde14f9612c45680b917,ACCUMULO-3340,ACCUMULO-3340 Restrict ZooKeeper binding in MAC
0f6a1bce0493b6258de1cb41007d3cceefdd2437,ACCUMULO-3289,ACCUMULO-3289 Had made a final change that didn't get pushed.
a8a6b15ada23af15839820e7677432036aee2d40,ACCUMULO-3334,ACCUMULO-3334 Fix arguments passed to TeraSortIngest by CloudStone4
e74986aee8da7021cb083bc56fc971b4dc9bc2ab,ACCUMULO-3333,ACCUMULO-3333 Pass in username and password to `accumulo shell`
7356a88eb2567f387de8104350a1511c23f79d20,ACCUMULO-3332,ACCUMULO-3332 Fix incorrect import in cloudstone slaves.py
27269c44437ca3e427263be4d3a05e9c299ef037,ACCUMULO-3289,ACCUMULO-3289 Increase memory as it appeared the one tserver might have had irregular timer thread activity
7f1a55b9ed6aff523c5f66c93692242e9fd86e37,ACCUMULO-3289,ACCUMULO-3289 Add logging to discern between application and network pauses for bulkImportFiles.
f98408233ad743bc65183602cd47ca8248fc108c,ACCUMULO-3323,ACCUMULO-3323 Fix script invocation blocks for github formatting
cdf01d718338ea29f0366e3b652d75c8ae081ccf,ACCUMULO-3320,ACCUMULO-3320 Fix up whitespace formatting.
20102d558db1f212b8c012480cd27d2f95633c93,ACCUMULO-3320,ACCUMULO-3320 Stabilize the test after a noticed failure.
00105ce12259de5d37a7e1e1fac4964b15b08be4,ACCUMULO-3320,ACCUMULO-3320 Some cleanup and add IT suffix to test name.
09cb6b2a82d6634c1bd991ed4a0012fb87a459f3,ACCUMULO-3320,ACCUMULO-3320 Integration test to ensure that WALs are not closed when a tserver may continue to use it.
84191c56e504f01903c31e5e6a617d5dea961c40,ACCUMULO-3320,ACCUMULO-3320 Normalize the WAL using Path.
f1aee3d4ea1a428885fb66f550f7391653d78187,ACCUMULO-3320,ACCUMULO-3320 Use the active WALs from each tserver to preclude WAL deletion
2b3473469d38241f3a9ada79d968853801d91597,ACCUMULO-3320,ACCUMULO-3320 Fetch the necessary info from the master and tservers in the GC
a754e1b3c025f5c610c2f07e92e8083a3190c86c,ACCUMULO-3320,ACCUMULO-3320 Add a new method to the master to get the active tservers
1053c0b64ec52de4cb3acc9e8bf0794ce63ead25,ACCUMULO-3320,ACCUMULO-3320 Update thrift idl
62e3e9b53b35da98c9fff32a1366911c94dd8c7b,ACCUMULO-3314,ACCUMULO-3314 Add a fair volume chooser to stabilize RewriteTabletDirectoriesIT
fa978b0c3097e7d94fe1c8e9a49db24175711221,ACCUMULO-3312,ACCUMULO-3312 Fix incorrect path generation during clone table.
c85bf4f7d99c9edac5d64db26ca1f7a89d2b80e8,ACCUMULO-3297,ACCUMULO-3297 allow metadata table reads even if all files have been allocated
cb262120e8c11ea0afd5c08eb1124d9975941c8f,ACCUMULO-3305,ACCUMULO-3305 Use stopProcessWithTimeout instead of directly using Process API
b7b55eb640b364374a04904ecd1e38d965ee0f58,ACCUMULO-3292,Revert "ACCUMULO-3292 Workaround which should make the test more stable."
1f674b4effd84f2e30f52fd624d963a78999d0d4,ACCUMULO-3301,ACCUMULO-3301 Fetch future tablet column from metadata.
b9d4c365b96558f1e46e9ef883e183b4ccba2884,ACCUMULO-3292,ACCUMULO-3292 Workaround which should make the test more stable.
39d3c78c689ccbdaaf5107f9e790d64600c4df58,ACCUMULO-3298,ACCUMULO-3298 Fix spelling error on DuplicateFilter
eb424221bafe583a37ad9c6a61b72d2820c37e46,ACCUMULO-3292,ACCUMULO-3292 Some extra information on flat out incorrect assertion failures.
2805630ef81041b6db671c2ed36178dbcf1a9846,ACCUMULO-3296,ACCUMULO-3296 If the stat for a node is null, it's already deleted. Quit.
b965b2e7849569bc2e2dca2c6ab4a9567b18fc5e,ACCUMULO-3286,ACCUMULO-3286 Clean up some assertions in ConditionalWriterIT
ea58cc8ee4dfd32ea3ef1d8a7e267a3c14686ad6,ACCUMULO-3244,ACCUMULO-3244 add filename to bulk import report
933e39ddcdbd8dac13c54965cdf21c2be5e4c7ff,ACCUMULO-3213,ACCUMULO-3213 Changed deprecation warning suppression from method to variable for ctubbsii
7b7b468f90162446e4ede935b7054ec40ebc96a3,ACCUMULO-3213,ACCUMULO-3213 Enable GC_FILE_ARCHIVE in MAC properties for ITs.
3f7f681492166df4f0d8e589339a812a3d953775,ACCUMULO-3213,ACCUMULO-3213 Fix hadoop 1 support.
e17d104c7ae0f2dd4625fba2506e6ad5f9450c87,ACCUMULO-3290,ACCUMULO-3290 Don't fail the test if we see a scan for the correct table that isn't yet running
a0ffb3df2867072564a274c157262cc839127390,ACCUMULO-3287,ACCUMULO-3287 Retry creation of the MAC if we can't start ZK
5e0f6a42635471cefee1f5b88d07dfd6060b1cd2,ACCUMULO-3280,ACCUMULO-3280 Clean up Initialize
09a4f0aa6b47a99a27f6a0be76771e38e571f742,ACCUMULO-3286,ACCUMULO-3286 Get some more output on conditional writer. Don't have enough info as to why it failed.
0c51290bce812e5d98462099f335d855ed2b91bc,ACCUMULO-3213,ACCUMULO-3213 Fix up merge issues.
d3900b21c79e1258c6a540fba866efef0ba8cd86,ACCUMULO-3213,ACCUMULO-3213 Fix up SimpleGarbageCollectorTest
43cee41a0d816c1bc72141b4c47aaca43aba1eed,ACCUMULO-3213,ACCUMULO-3213 Make DeleteTable archive files if configured.
ded67f1867874d46e69b4d28084eaed3a3844009,ACCUMULO-3213,ACCUMULO-3213 Fix the moveToTrash method name to be more accurate (archive or move to trash)
7ce1a649fe22120833c9c0505c4a1a4c41986eca,ACCUMULO-3213,ACCUMULO-3213 Archive files that the garbage collector would otherwise delete.
7e0ba16eddd0a21a649ffb9007d3156df879ba58,ACCUMULO-3182,ACCUMULO-3182 coverity found an unused update to a local variable
ca083a5b864b57650073204344bd5461d2a3d78e,ACCUMULO-3181,ACCUMULO-3181 VolumeChooser usage doesn't always comply with implied API contract
e4dbe897cfbd710549a0368e156a49181409a671,ACCUMULO-3264,ACCUMULO-3264 Only reset logging configuration when we're certain that we have configuration files
351c70eb2dec11baf6606a0063d43a0e29890909,ACCUMULO-3261,ACCUMULO-3261 Don't set empty ranges on the BatchScanner.
eaaebdf33b7d26a0977d2df252851639726abcf0,ACCUMULO-3249,ACCUMULO-3249 Didn't wait long enough to check for expected condition
6cbc58630d3507cadf641d8c2309ee15452aa4db,ACCUMULO-3249,ACCUMULO-3249 Create work only when there is work to be done for the status.
48f94bd2905e04b8df0051d57d019684473a3461,ACCUMULO-3249,ACCUMULO-3249 Work should be created regardless of open or closed
6a713aa4282ddfd658de7af05a801f5791cd4eec,ACCUMULO-3249,ACCUMULO-3249 Extra comments about issuing updates to replication status for WALs.
ceb131cb0702dddd01a62de5d4d1fea40b9cb172,ACCUMULO-3249,ACCUMULO-3249 When recovery of a tablet doesn't recover anything from a WAL, we must ignore it.
ebc4a0411bc523343a0b38fe75d221f28cd1e5c6,ACCUMULO-3249,ACCUMULO-3249 Remove an unnecessary utility method for clarity and reduce visibility on some internal methods
d75be63cf3e11e4d73289ed2adcf105d2bfc23fc,ACCUMULO-3249,ACCUMULO-3249 Clarify some comments
24921c72745a2908202ca13c084d1ec46aba4950,ACCUMULO-3249,ACCUMULO-3249 Some extra logging that's missing to get a clear picture.
758a364bda0b47520daf251d88e0057187884d66,ACCUMULO-3242,ACCUMULO-3242 Fix bug where transient exceptions didn't sleep before retrying
15e83709a4338da619392c99ee83bb016ff1c9c4,ACCUMULO-3242,ACCUMULO-3242 Spelling error, missing hashCode/toString/equals on ZKConnectionInfo, and some extra braces.
0e4159c3f389b71c36f81e07dce0e541ec40b183,ACCUMULO-3242,ACCUMULO-3242 Some general code cleanup. Unnecessary javadoc and duplicative ZooReaderWriter.getInstance() calls
423cf10a32d062e70ed97d1f85bb3c5c8642acbe,ACCUMULO-3242,ACCUMULO-3242 Fix up the retry logic in ZooCache.
1636055ac6d8d5fecae9e292be283b864d3d4341,ACCUMULO-3242,ACCUMULO-3242 Add some tests for Retry
1ce12aea2c61ad804e8c27a9a9d1b125bf9d2752,ACCUMULO-3242,ACCUMULO-3242 Rip out the rest of the improper ZK usages in ZooUtil.
6e71636462b3a5886502afcaed008e78ced0b4ef,ACCUMULO-3242,ACCUMULO-3242 Add some tests for ZooReaderWriter
c023f74e4329b8c764c46f9468681b71762e976a,ACCUMULO-3242,ACCUMULO-3242 Add proper retry logic to ZooReader, ZooReaderWriter and ZooUtil removing the RetryingInstance.
6ad16a9c50f48a98def23e5720218659a410dd08,ACCUMULO-3215,ACCUMULO-3215 Ensure tablet directories are absolute, not relative
1f9630d4cb5e2bf757a694e274895607bf014e16,ACCUMULO-3214,ACCUMULO-3214 Clear zoocache and retry when fail to get table configuration
f816e788956632cbc152a39c01dc7f4ee8c0c5cb,ACCUMULO-3230,ACCUMULO-3230 Include Hadoop's jersey libs on the classpath.
891584fb7dff4e6d7895f2341b9052559144ea70,ACCUMULO-3229,ACCUMULO-3229 Format long as decimal integer, not floating-point
1b35d2633e7558b49a1ff8887a3bc37c19d0b34f,ACCUMULO-3218,ACCUMULO-3218 Set the list separator to \0 to 'disable' list interpretation
a234def618365d723c19ca8e55825ddc89ce7690,ACCUMULO-3215,ACCUMULO-3215 Remove deprecated javadoc link
ccd4897e10290a57cb6eb4737bc694b14cf65aed,ACCUMULO-3217,ACCUMULO-3217 Fix use of deprecated members
ff1ceeaf678e465a56d987755a6af971b2b9e3ce,ACCUMULO-3215,ACCUMULO-3215 Ensure that ImportTable writes absolute paths, not relative.
854dce9fffb9766a65776e5c61af7710f1df0b75,ACCUMULO-3217,ACCUMULO-3217 Make KeyValue extend SimpleImmutableEntry instead of implement Map.Entry.
76de76075e73c6942069e962c44d7125d58fcae9,ACCUMULO-3213,ACCUMULO-3213 Instead of trying to start 100 threads at once, do 16 at a time
4a5bd7ef6ec1f0ae165733cf65bbc915b91e8532,ACCUMULO-3182,ACCUMULO-3182 Fix javadoc (link to non-visible member)
4ce6ee9079b2187286dc105133065bdffeda2438,ACCUMULO-3031,ACCUMULO-3031 Conditionally ignore known-bad test due to JDK bug
44bf5ed2b175cbc93ea0daf6c7c80c14b48c9fb3,ACCUMULO-3146,ACCUMULO-3146 Also give the tserver a bit more heap to make sure the tserver doesn't die.
9c4967e8fd9bb81d69bffd933eaa5a2834196303,ACCUMULO-3189,ACCUMULO-3189 add verification of compaction plan
43f787d68012badd4c980be2d36195a8ce56bf40,ACCUMULO-3183,ACCUMULO-3183 support loading compaction strategy from per table classpath
29ca17769803cb5d43e520effd6a235e844748b1,ACCUMULO-3182,ACCUMULO-3182 Fix incorrect fix at bad merge.
dc0d01ce8ca5a9f7642ec53017476db2c01d91b4,ACCUMULO-3182,ACCUMULO-3182 Attempt to fix bad merge
d65e0e32de29206b627e578b957ce66c0d644cea,ACCUMULO-3182,ACCUMULO-3182 Ensures that a WAL with a partial header (or completely) empty can be successfully recovered.
65acebbf94a6de9ed39e544da5d20df4695b5f49,ACCUMULO-3194,ACCUMULO-3194 Wait for more splits to happen before doing the verification and checking file distribution
ef7c4f0836abc9ea4fea664e0118c7ae2fdf4c30,ACCUMULO-2480,ACCUMULO-2480 Remove unnecessary curly brackets from variable initialization
d3586ea0de6690869492ad4d5dd4b69c58e367d5,ACCUMULO-3190,ACCUMULO-3190 Fix deprecation warning
8b17144e3ba1b4d5316ef2feeb70af815098da67,ACCUMULO-3135,ACCUMULO-3135 Fix javadoc misuse of link
8d316a3872f364eb9120a483afb63a761fa3ac04,ACCUMULO-3187,ACCUMULO-3187 Up the default memory for MAC for ExamplesIT
5f2d3473eb3f2e7c77d13fd5803a1ac9e2350f06,ACCUMULO-3085,ACCUMULO-3085 Fix log message
5459950dd70f7df01cf5dbebb8324e80cb034548,ACCUMULO-3180,ACCUMULO-3180 Better test naming and some extra functionality to SlowIterator
d8feff81e017ae08f1cbfcc9790c3490e7b10268,ACCUMULO-3030,ACCUMULO-3030 allow scanners to be interrupted
72156b82ecc05aa6dc072ab8d5dce5f328b140c8,ACCUMULO-2480,ACCUMULO-2480 make the tserver give up and die if openning the WAL experiences 5 errors in 10 seconds
2579d518bbd22def04bef9b145755312f4ca565f,ACCUMULO-3135,ACCUMULO-3135 Modify server-side table-operations to throw ThriftTableOperationException when table doesn't exist
a697516751426ec5143cea860ed6cbbaa85cf9af,ACCUMULO-1866,ACCUMULO-1866 fix deprecation warning in test
1b79f51c50f6354e1f15c8c4dfd29d790140d407,ACCUMULO-3130,ACCUMULO-3130 remove unused import
53705e7e863721a36237dc5a3646c473e0e5e6eb,ACCUMULO-3157,ACCUMULO-3157 ACCUMULO-3158 Fix compilation issues and ensure scanner is closed.
7983b2f2a0fbb543518ada541554793994215392,ACCUMULO-3157,ACCUMULO-3157 close scanners
91679936ece2893c64e75e64460372d39a791ca6,ACCUMULO-3157,ACCUMULO-3157 close scanners
6340cbc0a28343c6b26198287020a54c3db3ef2d,ACCUMULO-3155,ACCUMULO-3155 Fix example config to make the batchwalkers run every 30 minutes instead of 3000 minutes
ad1c807568a7271facad6a729e03378aae4b2841,ACCUMULO-3140,ACCUMULO-3140 made user initiated majC wait for current minC to finish
dcb081cae9d4ca5cd5f3e3b271f87196f5b2db55,ACCUMULO-3148,ACCUMULO-3148 Change the verification of HalfDeadTServerIT
449f7e02ba39e8bbe2eb25988d59cd7c9314c90a,ACCUMULO-3153,ACCUMULO-3153 ACCUMULO-3152
dcc2c5349b944a6dec7ac1d57175c4d9745c68f4,ACCUMULO-3152,ACCUMULO-3152 fix typo
287e4a67349c190ee5c52d91ee340ca53778e5c9,ACCUMULO-3152,ACCUMULO-3152 fix typo
693daa77399b634f40d62903cdbb27f9e84ceb36,ACCUMULO-3153,ACCUMULO-3153 ACCUMULO-3152
72fd6beccd093d544a880c4564917039b80ee23a,ACCUMULO-3150,ACCUMULO-3150 Set 0 for monitor log4j port config value
ddd2c3bc098531d8dadee1b5142cfb80c50f4c41,ACCUMULO-3143,ACCUMULO-3143 Offline scan property is now being properly serialized. Added verification that all other booleans are being serialized.
7a40f7bfa4c6e30467a24105da974687ac442cdf,ACCUMULO-3146,ACCUMULO-3146 Try to stabilize BalanceAfterCommsFailureIT and SimpleBalancerFairnessIT
992414ebba8109b601846b5c279bf72b8165485d,ACCUMULO-3145,ACCUMULO-3145 Fix loop invariants in listscans
32570d5a554503d7af6c76379edd8d46175637e2,ACCUMULO-3144,ACCUMULO-3144 Give the servers some time to flush out their buffers to the MAC log pipe.
255ce5f25164dc1c429ee57bbeecfdb1f976cacb,ACCUMULO-3078,ACCUMULO-3078 ACCUMULO-3138 Remove the getStaticCluster reference again
d0f95f85a484e190ddaeb753ab141ce7c3d84ff1,ACCUMULO-3139,ACCUMULO-3139 Some extra test stabilizations for BalanceAfterCommsFailureIT
4cf467b926d7beae17b47103105d892f24e75e70,ACCUMULO-3139,ACCUMULO-3139 Reflect on UNIXProcess to get the pid and use kill instead of pkill.
597b787cee82a0cb3a8c39e70de312878d0182fc,ACCUMULO-3132,ACCUMULO-3132 setting TInfo's serialization value is much simpler After discussing it with [~kturner], this change seems simpler and supports 1.6.1 -> 1.6.0 revert of an upgrade. The unit test will catch any re-generation of the file.
3e4d07b2fd967328fe1161b0dfad1fdf72191829,ACCUMULO-3138,ACCUMULO-3138 Pass down the SSL/CredentialProvider ClientConfiguration into the input format
2e273505d9ca2d32db48d2052f38be2625119bec,ACCUMULO-3136,ACCUMULO-3136 Be a little more rigid on the ActiveScans we observe.
498f32bdf32ca563abbfb98cd0db60a8cf093184,ACCUMULO-3132,ACCUMULO-3132 get TInfo out of TraceRepo
0055bab8b94bb87c1b65db6223a5ae8840d2d52c,ACCUMULO-3132,ACCUMULO-3132 kludge the deserialization to work with 1.6.0 FATE objects
94feef8972c9fff0e31e23680a0db42c032b768a,ACCUMULO-3130,ACCUMULO-3130 Remove config changes from debugging.
b5e97f59ac7b49e5558efaeb59ded6a15007d281,ACCUMULO-3130,ACCUMULO-3130 Fix UnorderedWorkAssignerReplicationIT for SSL
d1cd740aa435fc9a88e1665ceb308d1aee6f3d03,ACCUMULO-3131,ACCUMULO-3131 Make sure CyclicReplicationIT sets up SSL when requested
2da2304a684c067c4054b747958950e17893c057,ACCUMULO-3130,ACCUMULO-3130 Try to make the test end faster.
6e205e0c794c88b23c3e2a46baa3fdd0167ca5a3,ACCUMULO-3130,ACCUMULO-3130 Ensure MultiInstanceReplicationIT is running with SSL and credential providers
bc2862da37a89fa82c307bd956b7a88c2e3f92e9,ACCUMULO-3117,ACCUMULO-3117 Some extra logging I added when trying to figure out what was happening WRT replication.
83ed12ae3729f82ce1307e7fbee3215f1def0298,ACCUMULO-3117,ACCUMULO-3117 found some other replication tests failing with the 50M mutation queue
9a3ddc30603e54c12ecab0b80bafabab8c87fda2,ACCUMULO-3117,ACCUMULO-3117 set mutation queue to expected size
cee126f7340e68e86b6483932d2c2de40229df46,ACCUMULO-3120,ACCUMULO-3120 Replacing references to docs/config.html to the Configuration Management portion of the user manual.
d3e17f4582634e0f4985c1f3a92afcd67e999427,ACCUMULO-3119,ACCUMULO-3119 Cleanup javadocs in 1.6.x branch
22de8d5237ff14b9c46638df0f998368f80a5cc9,ACCUMULO-3078,ACCUMULO-3078 Fix ConditionalWriterIT trace test
d23cb34edff1a3fdd8487d27bbe6fe5db2983f70,ACCUMULO-2645,ACCUMULO-2645 Remove unused imports
f64482bf0f1d0bb84bc4a2e8bb62b180efe692b8,ACCUMULO-3093,ACCUMULO-3093 Remove unused import
618e0d400b6c1d31f96e84accff22479ecda88b4,ACCUMULO-3078,ACCUMULO-3078 Re-introduce warnings suppression for Job()
9b56159c10f52a549aa20da12ead855a9155ade8,ACCUMULO-3119,ACCUMULO-3119 Cleanup javadocs in 1.5.x branch
a05c96d819db7c08618a84c2ed516ca1765f07ce,ACCUMULO-3116,ACCUMULO-3116 increase the max split size so the test runs
d9e96d0c1701cf3a88173d53f019462e153a45cd,ACCUMULO-2645,ACCUMULO-2645 remove warnings (unused import)
2519b838e97e19bced5b24af841f2a8d54eeb42c,ACCUMULO-3113,ACCUMULO-3113 Increase the timeouts in testTimeout
7699e1f43c4ee51bfa4be1e9e73ea722f934a3d6,ACCUMULO-1628,ACCUMULO-1628 Fixes issue after previous changes which interrupted a deep-copy
0d76cd5205250469d30cb19f3af73090c295fe70,ACCUMULO-3111,ACCUMULO-3111 added some retries when checking the number of splits after merging in MetaSplitIT
7f329a9c4dbf6f249a14a1f4bde43f261bf12875,ACCUMULO-2645,ACCUMULO-2645 add (very) basic data about running scans to identify run-away queries
32840695fb2f79dcaab025d4100d5bb8066b8524,ACCUMULO-3109,ACCUMULO-3109 Stabilize MonitorLoggingIT some more
5c8ac744e5e9f3024b5b99cec2b6efe92dc5ac1d,ACCUMULO-3108,ACCUMULO-3108 Remove timeout attribute to allow timeout.factor to be used.
5be05eb7fccfb5e3d102ed08d962138e54573f3b,ACCUMULO-3104,ACCUMULO-3104 Set a very loose timeout for AccumuloInputFormatIT
ac270044ab7f0dd03cd8b40883ab4fdfbc1fd26b,ACCUMULO-3105,ACCUMULO-3105 use the standard charset
3bac1a07d67e56d8eb92edc5640a17c4ab69d0ca,ACCUMULO-3078,ACCUMULO-3078 cleanup warnings
aa17a2b948c7aa09ab0749fa32209c0531392a82,ACCUMULO-3078,ACCUMULO-3078 cleanup warnings
97c525cfdda52bc6e541e54d9af6695f01546511,ACCUMULO-3100,ACCUMULO-3100 cleanup warnings
793597cb7978203c76c6109bba1bb143ed96d869,ACCUMULO-3093,ACCUMULO-3093 cleanup warnings
ae01d35bca216e02c368d675b2e38033b2f6c3f4,ACCUMULO-3100,ACCUMULO-3100 Pull back Guava dependency from 15.0 to 14.0.1.
7eeb08ae940407ee29ce8673ea77a98a87ecd311,ACCUMULO-3093,ACCUMULO-3093: Use ContextManager to load the Formatter classes
8b2cbe77737220a5b5d3a2cdc049acd9bfc81ef6,ACCUMULO-3102,ACCUMULO-3102 Increase timeout for SplitRecoveryIT test on multinode
8429ea83c1cf88197a1fdb571629d2254ed98ecb,ACCUMULO-3101,ACCUMULO-3101 Increase timeout for some of ExamplesIT tests on multinode
632c572b211c6e152698436c4ef5759cad836e8b,ACCUMULO-3096,ACCUMULO-3096 stopped retrying metadata updates on contraint violations
0a5ceca5396cdc53ebda4b7e581f80d1c7917a72,ACCUMULO-3096,ACCUMULO-3096 stopped retrying metadata updates on contraint violations
fee5ec4f061d0244393e149020998613d37ecf27,ACCUMULO-3098,ACCUMULO-3098 fix timeout
f01ac9f995e35c7e1c990fb64f3cd68f98c0d083,ACCUMULO-3098,ACCUMULO-3098 fix timeout
4135e4f87c0fa4a967517f54ce67b77344ef735f,ACCUMULO-3078,ACCUMULO-3078 made some more ITs rely on a Connector where possible instead of a MAC instance
572d473d37778373006e5d1e6adfc299f19c9597,ACCUMULO-3084,ACCUMULO-3084 just warn about long timer delays
6f2fd4d3a54bad464dc3eb0982c4e4e2e5590366,ACCUMULO-3084,ACCUMULO-3084 just warn about long timer delays
b164e3b93639ce3cfc156dd7d95375dedc30d706,ACCUMULO-3084,ACCUMULO-3084 just warn about long timer delays
30a0ca3e81e5e27f870f8d5fad40f589a959feff,ACCUMULO-1628,ACCUMULO-1628 made InMemoryMap iterator deepCopy work after delete
ac2e60164626e51e5932d0c30c6b4b68ea1414c1,ACCUMULO-2037,ACCUMULO-2037 Close scanner
