a573f96d434fb5ef3016b8f7d3d9904e4fd88d65,ACCUMULO-1743,ACCUMULO-1743 wait for the trace table to exist
51f84de0ec2435e70c37846c7f363bfce3ebca00,ACCUMULO-1743,ACCUMULO-1743 added trace check of conditional writes
a89d97a003caa6a5a735098b6092f36ff86592b9,ACCUMULO-2036,ACCUMULO-2036 Try to get FQDN's for RangeInputSplit
a56b76602767c062cd80e93f0437758dab02a266,ACCUMULO-2124,ACCUMULO-2124 [~kturner] found another typo
9bfef59ffe75ccea174222f6b000b6009e611f65,ACCUMULO-2124,ACCUMULO-2124 minor updates to comments
27ee2367056e5ad0cb6175f91154cd13d49e2c95,ACCUMULO-1993,ACCUMULO-1993 ACCUMULO-1994 make proxy useful for ruby, fix getRowRange (and test it)
1ad1151ab0ae2c57ff998cf563cbe6a019994724,ACCUMULO-2116,ACCUMULO-2116 Examples functional test should run from outside of ACCUMULO_HOME.
d605ebb52a14d4d1964b01dcb5bb5ccad4fa6fb9,ACCUMULO-2109,ACCUMULO-2109 make sure functional tests clean up generate accumulo-site file.
16ccbf5e16467729b558cf08a379770cba10f5ab,ACCUMULO-2110,ACCUMULO-2110 cannot remove a FileRef with a Path
ec7724823628c240f6f31a3fbd5b4b59bb03053e,ACCUMULO-2110,ACCUMULO-2110 cannot remove a FileRef with a Path
379881e69bd7e93f11cfa13b415afe14be8634f6,ACCUMULO-2105,ACCUMULO-2105 cannot close instance
f56ae10b3e72e6d03fa6324afcd23619ea94b7b9,ACCUMULO-2112,ACCUMULO-2112 clear the bad server list of any server that is communicating
cbbcaac8889e4053f10d215b2fdfb09a085bffe3,ACCUMULO-2104,ACCUMULO-2104 ACCUMULO-2106 Close the MTBW before deleting the tables in RW
f35e3f47265868c560b3d49edebf1a8c24196512,ACCUMULO-1965,ACCUMULO-1965 Fix exception handling for namespaces
7838d4035f78376cbbd7452f7f8b013d4b398857,ACCUMULO-2101,ACCUMULO-2101 Check the environment for JAVA_HOME for native-maps Makefile
ccb6093bbc33bb5ec8155aca7a594c5c58719ca4,ACCUMULO-2091,ACCUMULO-2091 Catch AccumuloException in RW RenameTable.
9f59c0022777fc86d0b269d064bcc898b27c9b23,ACCUMULO-2096,ACCUMULO-2096 Clean up the security RW tests.
3cddee9ef10049219b551d578bbfa9f779697993,ACCUMULO-2093,ACCUMULO-2093 Exclude incomplete tables from listing.
db746960fbcafb1651c15ec2e5493d56acb5065c,ACCUMULO-2082,ACCUMULO-2082 fixed bug that allowed multiple threads to attempt to compact a single tablet
0d294ad64ed5a12c44e1c33bc5561897e3aef512,ACCUMULO-2087,ACCUMULO-2087 ACCUMULO-2086 Fixing formatting.
31f4fbf791935270d1e8094cc539f5eb1932ef92,ACCUMULO-2085,ACCUMULO-2085 Also catch NamespaceNotEmptyException when deleting a namespace.
744f06bfbf23f1cf3f8b0f8b785decd04e69842f,ACCUMULO-2087,ACCUMULO-2087 Check for the null result from zk and throw something slightly more meaningful.
e8c9aae904380f22e55a31e3a7422ecd4597b0b0,ACCUMULO-2086,ACCUMULO-2086 Use the tableID instead of the tableName where necessary.
92bd40c6ee5ce095321d5e876591874abc0b462e,ACCUMULO-2082,ACCUMULO-2082 Add in some better logging for the randomwalk Bulk tests.
55827af327c9e04ac010b821e135c56e5d95faaa,ACCUMULO-2078,ACCUMULO-2078 Fix the grep so that the example configurations are properly interpreted.
4cf60b651fa86c6ac2a6e9501dbdd2ae5467ff8f,ACCUMULO-2067,ACCUMULO-2067 Use urlencoding method already present in BasicServlet (thanks, [~ecn]).
6bf68ed0d6e725b8866e304fef693c9f6c6f71fe,ACCUMULO-2057,ACCUMULO-2057 caused ACCUMULO-2074 ACCUMULO-2075; copy-paste-error
e7f68b586f8317b1e1e94aa56e6adbeacc10670f,ACCUMULO-2067,ACCUMULO-2067 urlencode the table id used in the link.
36f503c653b2edbd29b37f79852602660e564db2,ACCUMULO-1997,ACCUMULO-1997 Verify that the ACCUMULO_HOME (computed or provided) is actually a directory
82d0555c7fef2668588d0f8fcb02b8ca71c325e0,ACCUMULO-2073,ACCUMULO-2073 Add in some basic timeouts on the conditional writer ITs
041b482f672bf6a147ac8c9d1646c5aee705d270,ACCUMULO-1593,ACCUMULO-1593 Applying Ted's patch to ensure UTF-8 String encoding applied to instance id pulled from ZK.
674fa95cacaa9353142071a66006e0ffb65cae94,ACCUMULO-1889,ACCUMULO-1889 found a few more ZooKeeperInstances that are not closed
6d083e44d18bc01eebe742bb023671760c581ef3,ACCUMULO-2057,ACCUMULO-2057 track lastLocation through a split
effd3651dffcd7057d3f4580c13d6f03d88d6652,ACCUMULO-2057,Revert "ACCUMULO-2057 track lastLocation through a split"
e11b3338a8719bbc702337038ca6188e9ee9d224,ACCUMULO-2057,Revert "ACCUMULO-2057 track lastLocation through a split"
9cae04863ae46bcd47b09ec883d39dc676574a53,ACCUMULO-2057,ACCUMULO-2057 track lastLocation through a split
2235b5038a85147cae3495d4d0368e0bd9f38098,ACCUMULO-2057,ACCUMULO-2057 handle multiple last locations gracefully
ba0d7d34395140f147484198652a0c25bbf0f165,ACCUMULO-2068,ACCUMULO-2068 Remove deprecation warning as we're preserving backwards compatibility for functionality that has existed for a very long time.
a480f63958cee884091fa1f0ad3c542fec5c385a,ACCUMULO-2065,ACCUMULO-2065 Using the hostname for the system running the monitor instead of what was passed via --address.
559b18bc73225ea2cc779ec727c8f49b29ab2924,ACCUMULO-2058,ACCUMULO-2058 Add shell env interpolation for ACCUMULO_CONF_DIR when extracting kerberos keytab value.
f228caff46816939b95f101942082a9da0277dce,ACCUMULO-1980,ACCUMULO-1980 No longer tries to use master to stop tserver if no masters
3743312d6369ff52691fdca03cb4338972823255,ACCUMULO-2025,ACCUMULO-2025 - splitting the tests caused duplicate tables being used. They now use unique tables and namespaces
2d97b875a90a63060bbda7c9e6d7e79e68de1ae2,ACCUMULO-1986,ACCUMULO-1986 merge failed to pull null pointer checks from 1.4
adee0f129f66c346e026b1803793caa233d29930,ACCUMULO-1986,ACCUMULO-1986 Add data integrity checks to Key and Mutation
5bb28edba7ff587191e8c33cd909e3677465af48,ACCUMULO-2029,ACCUMULO-2029 remove unnecessary import
b54b130491100b100caca72f1075a9dc91be5f5d,ACCUMULO-2037,ACCUMULO-2037 use the last location information
bec36bc3f4164dbb5bceb9b558b0aa9b0ae150c4,ACCUMULO-2037,ACCUMULO-2037 host:port[123456] sorts before host:port[], so the correct host was being skipped
59932f6d273067faaf9639ef4b632f67587bf5ad,ACCUMULO-2037,ACCUMULO-2037 master is not fetching last location from the metadata table
f37342bab253d939f70e9616a222379ea2843334,ACCUMULO-2029,ACCUMULO-2029 root table errors go in zookeeper (for now), don\'t need to decode url-encoded parameters on the recv side, the server does that for you
ae20660d8202cf511c5dbd07b164634fa6f32126,ACCUMULO-2035,ACCUMULO-2035 ACCUMULO-2025 I accidently made limitVersion always true instead of never true. Now proper.
39b22d3eb5fb478376ebbf80a7d388baf5fd0338,ACCUMULO-1980,ACCUMULO-1980 admin stop HOST now defaults to port.
0e3fd3b3cc26496f5a3e898c52f8fded16a5f203,ACCUMULO-2028,ACCUMULO-2028 avoid NPE during a table delete when balancing
37c9a76017eac42577fbbc4c217f2af76ea84779,ACCUMULO-1959,ACCUMULO-1959 - supressing deprecation warning
f06b067063c92c1ae46f0c02dc24ff40564741b6,ACCUMULO-1959,ACCUMULO-1959 Deprecate Value(ByteBuffer,boolean)
73cbdc04654286dfb91bdd7bb0b61507d6c42c01,ACCUMULO-2025,ACCUMULO-2025 - restored limitVersion doing things it's supposed to do. And mac test() uses it now
1291713b89b9bd41326d0b4b0cf741fcb29b896a,ACCUMULO-2013,ACCUMULO-2013 - fixing errors when cloning table
7a6fd95c8c1ad95f5001e84f00953fb9d2b620bd,ACCUMULO-2024,ACCUMULO-2024: fix config path property env variable substitution
82e2f57abd69e9b78eb10dc6f79d7f1a0e46576f,ACCUMULO-1990,ACCUMULO-1990 - "" no longer has versioning set up by default
72106a626ed27b2a849aa80639f8514b97710707,ACCUMULO-1896,ACCUMULO-1896 fix deb generation on clean checkout
7f37d96c33df2a0a13aa868c55c32444920f6a90,ACCUMULO-2009,ACCUMULO-2009 add commons-httpclient as a test dependency
622fc7d20744ae8a7e75ba0dc945777f94254b48,ACCUMULO-1999,ACCUMULO-1999 Backport changes from 1664 which advertise the Master's random port
998648d3ddeebf9295e62ab6069bdd47e96e1420,ACCUMULO-1900,ACCUMULO-1900 use the old deprecated API for 1.0 compatibility
3b08c717ed69a0734b1f0230fad39c3fc123f9aa,ACCUMULO-1896,ACCUMULO-1896 add lib/ext, logs, walogs to tgz
02275812b6ed7cec6c4923183f2f75011f4c4f4a,ACCUMULO-1978,ACCUMULO-1978 fixed compaction and flush of metadata table and added test
e945c8d69e9d081a0387866a0889b5da3726735b,ACCUMULO-1958,ACCUMULO-1958 Make Range constructor safe
cc68925ec08cb0ff14f30118526fb486449baf84,ACCUMULO-1958,ACCUMULO-1958 Make Range constructor safe
8f9258500e02e0be7965ebac3912d5dbd9e7c489,ACCUMULO-1987,ACCUMULO-1987 Fixes byte buffer copy bug
7655de68fa94a379afe3ed4eb65c16c060b7e475,ACCUMULO-1985,ACCUMULO-1985 Allow the monitor to bind to all network interfaces.
072ed61863bec0ee74d8a95bc82a2c81a0c5db5a,ACCUMULO-1942,ACCUMULO-1942 Make zookeeper provided in example pom
b9adbd7d6ed0a69921338e48d899c1693e50ff52,ACCUMULO-1952,ACCUMULO-1952 Update maven-dependency-version to get around upstream changes.
f0c12cd04761b40b4642b9a03640c11ee72ce0e0,ACCUMULO-1852,ACCUMULO-1852 Further fixes nativemap test on OSX
513f4d22c5dfe39e5dd372528edb6c2ce6c7525d,ACCUMULO-1968,ACCUMULO-1968 Update incorrect example documentation
6175d7a51838b471b96ffbdee17f4b327bf3de0e,ACCUMULO-1967,ACCUMULO-1967 Magitator should respect presence (or lack) of a 'gc' file
4a7c614ef8cd58aea02d55f0fd60b8654c388c2a,ACCUMULO-324,ACCUMULO-324 Don't inherit iters/constraints in system namespace
5b791b166b9190285bfb3ba3d45c3de0dbb93af1,ACCUMULO-1859,ACCUMULO-1859 update namepace config w/ new getPropertiesMethod
e1cf746acf8ce72692a2e6d9f4f20acc721814a1,ACCUMULO-324,ACCUMULO-324 made the system namespace ignore system-level (and site and default-level) iterators and constraints
b07d12976274876dfeb250ad0c2fe1e5a98e74cd,ACCUMULO-1953,ACCUMULO-1953: fix intermittent failure due to race in MultiTableBatchWriterTest.testOfflineTable
f1f28be82a2c27ad905d3bde0669b10ab93d4cf5,ACCUMULO-1905,ACCUMULO-1905 increased tserver.mutation.queue.max default to 1M
39260cb90be7129d91c21a3f85f625f8578ae554,ACCUMULO-1905,ACCUMULO-1905 added documentation about hsync to tserver.mutation.queue.max
cd96f85e0ec24be01d38c3a3dc78380f3b945d0b,ACCUMULO-1947,ACCUMULO-1947 Use DfsConfigKeys.DFS_DATANODE_SYNCONCLOSE_KEY instead of the CreateFlag class as a better way to check whether or not to we warn if the configuration doesn't contain dfs.datanode.synconclose=true
c7fc776562275e417b0497ba47a2a5a212eca04f,ACCUMULO-1947,ACCUMULO-1947 Remove forcefully setting the logger in a test with no reset after the test is done.
31b58c473d4abd4c7a9f51c558bdc89b61a92bfe,ACCUMULO-1556,ACCUMULO-1556 Clarify initialization error for used fs
07fa748e0f25acc59c76ca04fc37f84d84d3b12e,ACCUMULO-1556,ACCUMULO-1556 Clarify initialization error for used fs
1b3d071a8b46617245a39d039a2fe9e31600fc2e,ACCUMULO-1556,ACCUMULO-1556 Clarify initialization error for used fs
82477f08aa64e2a8a1cf7f6af0db5ce954801ac8,ACCUMULO-1940,ACCUMULO-1940 do not expose a new tablet to the memory manager until after it is online
40a007a2d57f53f4430164eda95f513444ac2897,ACCUMULO-1941,ACCUMULO-1941 Fix TabletIT test
edae90f593da385e3a6d58063a2d41fbdbb543aa,ACCUMULO-1937,ACCUMULO-1937 decrease log severity for expected case of a tablet no longer being in the unopened set at the moment it is being loaded
80fd647976db5baff8c1a372beee11e25d0428d9,ACCUMULO-1939,ACCUMULO-1939 Fix ConcurrentModificationException in MAC
8d39b09b212a67ad0e8379ddf18cf3624d9d2152,ACCUMULO-1934,ACCUMULO-1934 cleaning up imports, dead code, unused vars
f8e14c794992bd5d8d530b50338b16436088c243,ACCUMULO-1854,ACCUMULO-1854 Remove compiler warnings
51dd805097eeca9404b78e5b332c9aebb09c9ed4,ACCUMULO-1920,ACCUMULO-1920 fix needs to be in 1.4 branch, too
f896c9566c9a483bcf7d074efce16b1f1c88ed2c,ACCUMULO-1920,ACCUMULO-1920 should not close shared zookeeper session; clean up unused watcher list
6446ad5c20fec4b4506a01ac259c26d08974faf4,ACCUMULO-1876,ACCUMULO-1876 Add default values for hadoop.version and httpclient.version to make ivy work.
c093974647a93f70320c5d62eeff00e27fa3149d,ACCUMULO-1876,ACCUMULO-1876 default for slf4j.version
3a3509604a71a549c4b1f07d1411b3e25bf3f7bf,ACCUMULO-645,ACCUMULO-645 found another HADOOP_HOME reference
5dd9016a1d406618531725e6ce111b59acae72ec,ACCUMULO-645,ACCUMULO-645 found another HADOOP_HOME reference
d16fd77fa10afedab3bffe17235a3d700fd8de8e,ACCUMULO-645,ACCUMULO-645 found and removed many other references to HADOOP_HOME
d70e5a12739a7775995340be3dca5d460cdf7be2,ACCUMULO-645,ACCUMULO-645: found more references to HADOOP_HOME
344e725426e76b952d0f390d65ef6062c35fdc03,ACCUMULO-645,ACCUMULO-645 switch to using HADOOP_PREFIX and HADOOP_CONF_DIR
5d22af4903f49682db98f39d46509f089aeebe86,ACCUMULO-873,ACCUMULO-873 removed hdfs info from accumulo monitor page
4c16d8b82713cb888e33a224a57d0d41b156b50b,ACCUMULO-769,ACCUMULO-769 Fix Hadoop 2.0 breakage by removing methods marked as deprecated that didn't exist in prior version. ACCUMULO-975 Fix proxy pom.xml to support Hadoop 2.0
0f97284da4c1b33eccccf1b423003d490e2f81a8,ACCUMULO-876,ACCUMULO-876 added maven profiles to assist in compiling against different versions of hadoop
aff0d641274d78a5682defbd5e6d0717aac68546,ACCUMULO-1520,ACCUMULO-1520 misc functional test fixes
919691010835462f1dff42ee097a2f6cddf4e76b,ACCUMULO-1925,ACCUMULO-1925 ensure system tests respect ACCUMULO_CONF_DIR.
1fe5f7f528d39746c0e5cffb8710b4db21c3a5b2,ACCUMULO-1878,ACCUMULO-1878 handle error conditions in example tests.
d0ceebbf0ae8198ec68f3d581c259013c73f4664,ACCUMULO-1893,ACCUMULO-1893 keep tests from attempting to write to the root of HDFS.
855593862bec796035eb5dfd07100485c9965b80,ACCUMULO-1921,ACCUMULO-1921 fixed formatting
100e75bece15ad2d223070912854430d078e587a,ACCUMULO-1899,ACCUMULO-1899 exit with non-zero exit code if there's an error parsing the arguments.
e6e1df41abad9291b919b675147e211ad7cc8cef,ACCUMULO-1854,ACCUMULO-1854 More missing licenses
c88d87aa08819ed94fa9aae8583985b4fcf8e588,ACCUMULO-1854,ACCUMULO-1854 Update tests for hadoop-2 compatibility
6caa1597231bddc806fa2e8f4be596fc1e95e949,ACCUMULO-1854,ACCUMULO-1854 Add in missing license.
7dd3592cdcc333d221477d6b97584e1f1c514e3b,ACCUMULO-1921,ACCUMULO-1921 check for null
40d491807dfc473b396c8444772b91e5f1057288,ACCUMULO-1911,ACCUMULO-1911 increase the zookeeper poll rate to 5 seconds
435b5c721ca585f68b7b2f5217d5cbb128ab71df,ACCUMULO-1922,ACCUMULO-1922 accomodate new jar structure
11acdf86d05ee512c056e846311c1c3fb8d432dd,ACCUMULO-1920,ACCUMULO-1920 should not close shared zookeeper session; clean up unused watcher list
e1dd6f9b28fa579eada4334b7072fca4155add15,ACCUMULO-1854,ACCUMULO-1854 Remove todo and finish toString
8dd3ae4b1d614182f26d382d3d16956726d26702,ACCUMULO-1854,ACCUMULO-1854 Remove unnecessary arguments from methods
67189202183342888dc9b00b5ef3366e748997d6,ACCUMULO-1854,ACCUMULO-1854 Merge the mapred and mapreduce RangeInputSplits into one class
03b065d2d42945f4edf50d2510a15f523accd0b5,ACCUMULO-1854,ACCUMULO-1854 Get the mapred package code working with the new approach as well.
ef64992c6ef35ee4aba1ea0970981761e589e8c4,ACCUMULO-1854,ACCUMULO-1854 Account for 1.4 to 1.5 changes in how Authorizations.serialize works.
e08736d7900b22d83a0e28c93696f6ef20086942,ACCUMULO-1854,ACCUMULO-1854 Get the mapreduce unit tests working again
f4e4c39de9c599067f4a0b35007d11302c3bd709,ACCUMULO-1854,ACCUMULO-1854 Removing unnecessary configurations.
3beb9f710f526672fc67850b84c4999d968dc925,ACCUMULO-1854,ACCUMULO-1854 Remove unnecessary arguments from methods
2aad7fe0af7701609df67dea3daf872a526761be,ACCUMULO-1852,ACCUMULO-1852 Fix native maps on OS X 10.9
de8ecd4a71cb7fda3525798c7e658c8f65efe6c2,ACCUMULO-1866,ACCUMULO-1866 Add missing deprecation annotations
32b5aee44f4b6b1bdd4b531132c6f855f433bcc8,ACCUMULO-1866,ACCUMULO-1866 avoid using ServerConfigurationUtil in server code
7eaedc45b0e59edbd583965cf9a602ce59bf3faf,ACCUMULO-1914,ACCUMULO-1914 make WALog cleanup after recovery an atomic mutation
2640ea9d926f771274ed10efd23e7400a483f6c0,ACCUMULO-1914,ACCUMULO-1914 make WALog cleanup after recovery an atomic mutation
8bd6e0ebacb8fafeef8627807f610f10b036be6e,ACCUMULO-1914,ACCUMULO-1914 make WALog cleanup after recovery an atomic mutation
efb424680fd7edb1a475fbb2015af2bc8d0583a4,ACCUMULO-1866,ACCUMULO-1866 deprecated Instance.getConfiguration()
ae0be1f60db5b3b2493f5816f4481c1b092ae6bf,ACCUMULO-1062,ACCUMULO-1062 disabling testParallelWriteSpeed
054a89e4b03532262877d6e0f7c07ddd332a7406,ACCUMULO-1908,ACCUMULO-1908 Manually set filter on table and force deletetable.
2ad8a4f3eb2a3e3c8d00ebfba6a1218ed6ff824c,ACCUMULO-1908,ACCUMULO-1908 Make an odd du assertion a little more odd.
316a84b54cf68cc8051d1971b3123e52c20338ef,ACCUMULO-1908,ACCUMULO-1908 Add in small sleeps to let ZK information propogate.
e326641039942a25114490c0291c3386c4354d73,ACCUMULO-1873,ACCUMULO-1873 follow symlinks
0927eb83067ad2f209f67ab25a7c5b9009b18000,ACCUMULO-1873,ACCUMULO-1873 Better ZOOKEEPER_HOME check in start-all.sh
ada4180379d46297c1531cf8065de5030d12953d,ACCUMULO-1889,ACCUMULO-1889 mark ZKI as closed once close() is called.
6f07d7aaacaa93ce8dbcb1747bc1bccdfade008b,ACCUMULO-1901,ACCUMULO-1901 treat the gc start/stop like the redundant masters
d8b4ba9424d5cb7b2f1260f63386b2c7f478b306,ACCUMULO-1901,ACCUMULO-1901 treat the gc start/stop like the redundant masters
ffb26a25ffc94d28a9e1de93054ed5a8590cb943,ACCUMULO-1901,ACCUMULO-1901 treat the gc start/stop like the redundant masters
4976a935f2566ee648d20c3bc5381bc22edc51ec,ACCUMULO-1901,ACCUMULO-1901 treat the gc start/stop like the redundant masters
32b6b65766a695b8da76bdee36df13baace6f904,ACCUMULO-1903,ACCUMULO-1903 prefer the cached, reusable ZooReaderWriter over raw Zookeeper API
60dd8bd732ce0596150e49ae06fa7605aa0a15fd,ACCUMULO-1892,ACCUMULO-1892 redo resolving conflict resolution from 1.4 merge
a7c5b72d3b5b28775106adf87dab2f76f5c1430e,ACCUMULO-1858,ACCUMULO-1858 Fixed compilation error from bad merge.
79d686faa1e477b9cbd80c6f833ece402050b490,ACCUMULO-1858,ACCUMULO-1858 Backport ZooKeeper clean up to 1.4 and 1.5.
4119611eea4bc5780761ec17691483dac3e95f47,ACCUMULO-1892,ACCUMULO-1892 changes RandomBatchWriter to ensure it writes the specified number of rowids.
268028f8c17118208d45119ec26fc3e929a7f179,ACCUMULO-1891,ACCUMULO-1891 sets errorcode to default if it is null during message lookup.
feb0f3151d9849c7cca669278ec2d9a8f7aeec35,ACCUMULO-1874,ACCUMULO-1874 Remove warning
c32fb19084688ff6c4e2c246c72b9e9783d84915,ACCUMULO-1859,ACCUMULO-1859 dramatically sped up iterating over Accumulo configs
1e96138bb544e02829474011df850d5f28f299e6,ACCUMULO-1870,ACCUMULO-1870 Functional tests don't configure Monitor log
743d64b29d83587170e71c22dab9915548b61e3e,ACCUMULO-1839,ACCUMULO-1839 Fix ACCUMULO_CONF_DIR usage in Accumulo.java
e5dfd06ce9f52b606984c1331f6ee2c155f44d1d,ACCUMULO-1884,ACCUMULO-1884 Fix NativeMap Makefile for OS X
8beeaa6c1f90649d567bca95d60ae6b99399a80b,ACCUMULO-1867,ACCUMULO-1867 use the correct file system when reading the indexes of existing files
5ded019232528880fa1746134799571abde19a85,ACCUMULO-1867,ACCUMULO-1867 use the correct file system when reading the indexes of existing files
ff9bfeb8810794b10ab69b18998a6fe183e45a29,ACCUMULO-1881,ACCUMULO-1881 added fake username to ShellConfigTest
ed11bd3d0125ebb3ea3f4e872ab0d0a52b5d8c5f,ACCUMULO-1876,ACCUMULO-1876 Update the default versions from hadoop1 to hadoop2 values.
20cbf248e27069c0c05a595342de73e9ecc43743,ACCUMULO-1876,ACCUMULO-1876 Add default values for hadoop.version and httpclient.version to make ivy work.
850bd3e7300425ae78f51d41f67912604f2bb914,ACCUMULO-1876,ACCUMULO-1876 default for slf4j.version
c93872afd3e191ea81e353e609749128d3b5c417,ACCUMULO-1876,ACCUMULO-1876 default for slf4j.version
d059d007766920b58946a52e2c051ab19b8e8bda,ACCUMULO-1434,ACCUMULO-1434 Added 'empty' node to CV parse tree
d868e30d7bc60b3478272bbdd395a45a5ba05a69,ACCUMULO-1874,ACCUMULO-1874 removed usage of Job.getInstance, moved job instance creation to a utility class for examples
b005a24112affb011d15168963a76dac6434f491,ACCUMULO-1862,ACCUMULO-1862 implement the desired truncate
61d00d47ddca609a3cff37bdca9140cc8457ba20,ACCUMULO-1846,ACCUMULO-1846 Fix ClassNotFoundException for default log closer
b64149d782ef521347fb16bfeecc5c7522a6ee7d,ACCUMULO-1830,ACCUMULO-1830 fix WAL to use consistent METADATA entries
16115f000bf9500b38a01462c25ca5458ae1543f,ACCUMULO-1830,ACCUMULO-1830 add an integration test that detects the problem
a974a4ad2c5afda425af41eff08ed2fe0f00d62a,ACCUMULO-1841,ACCUMULO-1841 Include missing jars in assembly; remove dupe
96b8d23a71252e3d18b03c94c86dd3a307b4845f,ACCUMULO-1843,ACCUMULO-1843 Use the correct name that Platform.getPlatform generates when building the native map library
e639ac33b0a19252ce04d250717b918558f39014,ACCUMULO-1842,ACCUMULO-1842 Fix Main to actually reference the correct class.
b8b1b96a15dab0b17bda163d47b048a6199ed7db,ACCUMULO-1837,ACCUMULO-1837: fix JS error
e328eab6e25f3d3bbcb7e4ed2690c1373e8d2a26,ACCUMULO-1471,ACCUMULO-1471: more doc on SortedMapIterator explaining what you want if you're just looking for a simple Map-backed Iterator
6140f926d545ca00bd572f4d58cb6a105eba04d5,ACCUMULO-1514,ACCUMULO-1514 - dynamic classloader more like regular classloader
5b8efba01a2c654a618d7fb0b46c2981f7b3b3bf,ACCUMULO-1823,ACCUMULO-1823 more tweaks to help stabilize the ITs
135e67b68592f0d1c7ca69bac318a7ad3ed55831,ACCUMULO-1823,ACCUMULO-1823 more tweaks to help stabilize the ITs, get more debugging for post-test analysis
71934fb42e9e79feec334bd0fc7317092a6606ec,ACCUMULO-1823,ACCUMULO-1823 deal with hadoop-2.2 throwing an exception
2f5974ca62ac58b07a53e021652f4b80756dc07d,ACCUMULO-1514,ACCUMULO-1514 Dynamic classloader now has same behavior as general classloader
9a2041d56019e253b08732c9d931e99981f41660,ACCUMULO-1681,ACCUMULO-1681 - Rolling in match (after merging)
8683295fcf4e8732e8dc7625f97725cfe0662e1f,ACCUMULO-1821,ACCUMULO-1821 don't record log events if the tablet is not online
4d493b467ed0c695616bb98878ba929f67ca586e,ACCUMULO-1821,ACCUMULO-1821 don't record log events if the tablet is not online
9e8370253e8471b66a6ed5b871f988481d930731,ACCUMULO-1819,ACCUMULO-1819 fix warning about useless assignment
8fb6c860709419e95b16d18af3d4101ae035abd2,ACCUMULO-1042,ACCUMULO-1042 use jline 2.11 for ctrl-c
d61afcc28901c3d1bf34a5940b76f2e140f3f340,ACCUMULO-1587,ACCUMULO-1587 add 'print to file' for grep
8730d5cef37f301fc3f204a48e6af63c32a4f207,ACCUMULO-1814,ACCUMULO-1814 Fixes WALog reading issue from 1.5
090a8cf68464e414741edbf4eefe9f47c59a4daf,ACCUMULO-1819,ACCUMULO-1819 Screwed up the merge conflict
0e882211f2bda4bfb544463e076eea0fdd7dd3e9,ACCUMULO-1819,ACCUMULO-1819 Update Makefile for native map to build on new OSX version
aa0dcf25352e97bf50996ad8bfe2284167aa9565,ACCUMULO-1683,ACCUMULO-1683 - Replacing com.yahoo.zookeeper in conf examples with org.apache.zookeeper
9e32d86ecb374bdcd5ec554488afda04e23f8958,ACCUMULO-1803,ACCUMULO-1803 remove classes unneeded for functional test, found SplitRecoverIT was not working as intended
c7b810b55b445267680566c96990b7c518a21162,ACCUMULO-1714,ACCUMULO-1714 - Adding necessary crypto readme information to the README
9f86320996b3a7c77f9c5cb263246f9fabe56b24,ACCUMULO-1714,ACCUMULO-1714 - adding necessary README section for crypto
c3ca9872a1b272fc89b006cdc779f61bb7237759,ACCUMULO-1803,ACCUMULO-1803 remove auto
3f6c66ede52cb1fb5a122d7bad06d7978ff0a671,ACCUMULO-1379,ACCUMULO-1379 Fix edge cases if error in closing ZooKeeperInstance
ab6779c30c0308b5905e894c74fce24f6aca7679,ACCUMULO-1637,ACCUMULO-1637 Update the HDFS configuration check in VolumnManagerImpl from the one in TabletServer.
821ecec331e6f6be70eb93d750f9e0b5fe029133,ACCUMULO-1813,ACCUMULO-1813 increase wait time for GC to work
b2adcaa3e405041ce300dc5b157c473cf91211fb,ACCUMULO-1812,ACCUMULO-1812 translate ClosedChannelException into LogClosedException
7e04aefe36089ec5654f9676197278eb33b26f3d,ACCUMULO-1811,ACCUMULO-1811 demote message, and make the message more informative
a7e159219a29ca6f127616fd965aa857900e3f9c,ACCUMULO-1809,ACCUMULO-1809 parse short args and use reflection tricks to update counters
941e3cb1acbdb3ad2047e512d5fe3c95e595496b,ACCUMULO-1732,ACCUMULO-1732 fixed input format w/ mock
7f6e512278a365c9bbb525c8d8fee57e5d573d24,ACCUMULO-1732,ACCUMULO-1732 Input format changes : used table id exclusively, fixed issues with table propagation, removed some duplicated code
f9759261e12a5334af86ef9767750195692eded6,ACCUMULO-1584,ACCUMULO-1584 applying Jonathan Hsieh's patch
ffd16c7adbfd99f7acbba08ad9934acd5c80a7df,ACCUMULO-1800,ACCUMULO-1800 fix deletes, added test
3e74ee6654b879ca4eccf7b6f5469d4fa92b4b66,ACCUMULO-1732,ACCUMULO-1732 fix AccumuloInputFormatIT
b0c5e535af1e6fcc8d28ef580a1cbdc8e2aa55fc,ACCUMULO-1788,ACCUMULO-1788 fix test, use the right filesystem to create/delete a _tmp file
957676e681c46044e9b46f172b8ab96bfdc6715a,ACCUMULO-1637,ACCUMULO-1637 Removing some bad tests that aren't portable across hadoop versions.
0987628299165740230de132f85b3c63789ad584,ACCUMULO-1637,ACCUMULO-1637 Add tests for append/sync conf check
18bcd14ca8020e969b9881c44cc3c565471cae5b,ACCUMULO-1637,ACCUMULO-1637 Missed a usage of the DFSConfigKeys constant that might not always be present.
19e24abffb7a919ea406ab5c2b08ef0e3b385b74,ACCUMULO-1786,ACCUMULO-1786 Use the PortUtils to get a free port for the test
1b38c037a6c509c64ace9b55f8fe7fc9fb7dac87,ACCUMULO-1784,ACCUMULO-1784 fix minimum block size complaint for hadoop-2.2.0
b539fa01a57770cbf7313148aa49b872e8220f7d,ACCUMULO-1784,ACCUMULO-1784 fix minimum block size complaint for hadoop-2.2.0
685cc4a70d87fd7eda56538fb381a8347b4e56e3,ACCUMULO-1637,ACCUMULO-1637 Lifting the ticket message into its own string constant
d1243aafc7dfc9d14ccbe7d67f92055e26228221,ACCUMULO-1637,ACCUMULO-1637 Rework the hadoop append/sync checks trying to match what Hadoop is doing internally by default.
a65fe6a2b0b66b28c232da8025966cdafc4159fb,ACCUMULO-1781,ACCUMULO-1781 Adding license header to minicluster.properties
45559c862425462cfc3a786237608756181dd6df,ACCUMULO-1781,ACCUMULO-1781 Adding miniDFS support to MACRunner. Adding sample property file
929279c79907d7f87b208290de0859cca61ccb96,ACCUMULO-1752,ACCUMULO-1752 Added 10 second timeout if Zookeeper process fails during MAC start
872b6db372bba953e3c435fcfcb1c64c0713ff49,ACCUMULO-1730,ACCUMULO-1730 Reinsert changes inadvertently lost in cherry-pick
