4aef9626559bf30befda672077659ef4fe50d143,ACCUMULO-4833,ACCUMULO-4833 Disable broken randomwalk task
9fdf43a8ac044f6744700e04162cf8cc8a75d8bb,ACCUMULO-4585,ACCUMULO-4585 Fix bootstrap_config memory profiles
44d1f4a0eeb585177eac2d9d86d7bb89f25ce898,ACCUMULO-4585,ACCUMULO-4585 Fix bootstrap_config memory profiles
d0921d1b74532609e6a9d6b271aa674723645eac,ACCUMULO-3389,ACCUMULO-3389 Fix name in tsBatchDeleter (#406)
c4f36852a2c244b83705fe4f04df8bc450dd39d1,ACCUMULO-4836,ACCUMULO-4836 make online table always wait (#394)
6ef308a888d25fe73734dac600b8d14460d22a6c,ACCUMULO-3389,ACCUMULO-3389 Iterator Names can't contain dots (#397)
db200c7e9926851d9c2a3724a2c9576b685783df,ACCUMULO-4847,ACCUMULO-4847 Fix broken TabletServerGivesUpIT
cf0dd9c6471b0979643d913bef423efb45c5cac0,ACCUMULO-4847,ACCUMULO-4847 Fix Retry utility's API (#399)
68f70d5d557ad9ceec8acfb509906dbc19a0cf15,ACCUMULO-4835,ACCUMULO-4835 Make TableOps throw TableNotFound (#395)
e0cf7cd489c069d6b9fd4918ecc84d751b0b3cf8,ACCUMULO-4832,Fixes ACCUMULO-4832 WAL warnings
abdf269c7911a3ee8d18220a664b976645b00781,ACCUMULO-4829,ACCUMULO-4829 Avoid a dependency-analysis issue with hadoop-client-runtime
eb8ea99f5e37cdcf7e7c9a823ac3a7f8ac05c596,ACCUMULO-4639,ACCUMULO-4639 Relocate NullTserver test class
7bb91ede4804ce72b7dbf295588bdfa130599e0c,ACCUMULO-4678,ACCUMULO-4678 Fix MonitorSslIT failure
fb7299118fbe16f41e969fccbc8aadaa30bd0d88,ACCUMULO-4805,ACCUMULO-4805 Optimize file manager when no files to open (#389)
3db52e0bff7d855d2b769966f9a9804837ad93a0,ACCUMULO-4782,ACCUMULO-4782 switch session manager to a concurrent map (#382)
f40f7c1ce1d27856d57193fab516c39c85d22d52,ACCUMULO-4809,ACCUMULO-4809 Avoid blocking during session cleanup (#383)
229eb7be7f040ecdf1f0238201533529da59bca7,ACCUMULO-4787,[ACCUMULO-4787] Close input stream in AccumuloReplicaSystem (#369)
927e67361ba3ef621f680431b5acee180998102d,ACCUMULO-4787,[ACCUMULO-4787] Close input stream in AccumuloReplicaSystem (#369)
86d6a69ec8e4e7fe1b187c4a53b8c0a88921ab27,ACCUMULO-4805,ACCUMULO-4805 Obtain filemanager lock once when opening files (#380)
3ca3d65962e5229a44d67ef46233467d53a7016c,ACCUMULO-4779,ACCUMULO-4779 Improved performance of get by prefix in config (#372)
7b123b6ea77c5ba09f1875dad0f0f421096e4f2b,ACCUMULO-4779,Revert "ACCUMULO-4779 fixed classpath context config performance issue (#358)"
8d3bcdaf345af2a57666b148bf1176561fa797e9,ACCUMULO-4779,Revert "ACCUMULO-4779 Avoid locks in ZooCache when data in cache"
0b446a31cb7425f153bd7278e739c216cf26e8a4,ACCUMULO-4779,Revert "ACCUMULO-4779 made getting vfs config more efficient"
51cc9874a34a7890fa645b034a0038d041ed2216,ACCUMULO-4779,Revert "ACCUMULO-4779 Fix warning; remove unused field"
505d999b6944d8a91201257a4891a1ced6f64e25,ACCUMULO-4778,Revert "ACCUMULO-4778 Cache table name to id map (#364)"
cf0b8aa4994e10242478c4d9412d924d7e6de91c,ACCUMULO-4779,Revert "ACCUMULO-4779 Speedup Property by precomputing and avoiding sync (#366)"
b52db479e9c4e371a94b1f019e818622562e3dc3,ACCUMULO-4777,ACCUMULO-4777 Refine retry logging
1fe3ba12a943e590b89b2979e661e7dc447d0774,ACCUMULO-4779,ACCUMULO-4779 Speedup Property by precomputing and avoiding sync (#366)
05c165b5f61427b22024f1c78a4295c06a93aad6,ACCUMULO-4778,ACCUMULO-4778 Fix findbugs failure
5adeb4b7ed561a0bcea1a1def17835310831662f,ACCUMULO-4778,ACCUMULO-4778 Cache table name to id map (#364)
d8d2afa11037e41504d8f9347c1f6d36002e4a6a,ACCUMULO-4779,ACCUMULO-4779 Fix warning; remove unused field
7bc630cdce4a0aa02be4873e2873ff1036a94e14,ACCUMULO-4779,ACCUMULO-4779 made getting vfs config more efficient
cf9e754b045e3fac452df282bcf4ec97974038a0,ACCUMULO-4779,ACCUMULO-4779 Avoid locks in ZooCache when data in cache
79e127f2b1dd7352bdc7b30ceef74391d4930a9f,ACCUMULO-4777,ACCUMULO-4777: Added a backoff mechanism for writing to the WALs as we do for creating WALs but with unlimited retries.
37e2395c690b08c6ab1cb74a31c95560527f8c8b,ACCUMULO-4777,ACCUMULO-4777 Removed the unused sequence generator.
8477d9345dffdbb492a397571d6381950d098449,ACCUMULO-3361,ACCUMULO-3361 CryptoTest created files in /tmp/tmp
28b53e007f77cbf6c2ddea424d8eaf327f5569ec,ACCUMULO-4611,ACCUMULO-4611 Remove commons-config from API
9ac92c726ca3415981e1d973175440374f02060e,ACCUMULO-4611,ACCUMULO-4611 Deprecate public API with commons config
65f9913f55ada63feeb0e56df1da544b8c7785b1,ACCUMULO-4611,ACCUMULO-4611 Bump to version 1.9.0-SNAPSHOT
93a4f0fb5741a9c8686e0e74155d9e39ddb297dd,ACCUMULO-4786,ACCUMULO-4786 Fix XML and JSON links in Monitor
6782ba6b9d43dc9a10df4bbadf3a89eaadb0cf6a,ACCUMULO-4775,ACCUMULO-4775 Improved mocking in SetIterCommandTest
b2e2563b83a23f6e1ba7dc328ef6500cd5dd4dd2,ACCUMULO-4781,ACCUMULO-4781 changed session logging to trace
53c30777e96e6880a466eb8282d2b1a9ac9abf93,ACCUMULO-4775,[ACCUMULO-4775] Skip negate column entirely in ColumnAgeOffFilter (#349)
d99592c150794e609b20696df5a26f3c88086fbc,ACCUMULO-4780,ACCUMULO-4780 Add overflow check to seq num in CommitSession (#360)
8c27bdf0e0168f854e9bb6effad25e6b6b0cb853,ACCUMULO-4779,ACCUMULO-4779 fixed classpath context config performance issue (#358)
03a610e489f266ccc44d182321fdc1731ac4d6f3,ACCUMULO-4781,ACCUMULO-4781 fixed logging performance issue (#359)
721d13f5ef1917fd96937e973fda196019f4f582,ACCUMULO-3902,ACCUMULO-3902 Remove redundant close call
ed981b208ac70d9e819b0e8e0b229d8189c859e0,ACCUMULO-3902,ACCUMULO-3902 Ensure [Batch]Scanners are closed in ITs (#341)
bad30a1dd059006c607948c35db6feedd5ba7248,ACCUMULO-4776,ACCUMULO-4776 Fix advertised host in monitor
5203d3bdb5c39a782651399e00347f18b85e24c3,ACCUMULO-4770,ACCUMULO-4770 Show all ZooKeeper nodes on monitor
208cfeaf57e910683cd0215ea2f5487a98dab22b,ACCUMULO-4760,ACCUMULO-4760 Fix NPE in Monitor replication rest
21d2ea28494005fcd6860244b9d7d86d4f29993b,ACCUMULO-1972,ACCUMULO-1972 fix Range constructor
3161b98f05615844caf6980c8b5922375e92bd32,ACCUMULO-4751,ACCUMULO-4751 Set createdTime for status records
0a7c465d9eace6b8c9dccdfd37a92a0e1bcfbd52,ACCUMULO-4751,ACCUMULO-4751 Set createdTime for status records
15b00dff60782579e5a7febc90cbabb80e3b7b9a,ACCUMULO-4774,ACCUMULO-4774 Use lambda for ConditionalWriter's ThreadFactory
52118ef518fc7a98b41519e292840d8388941bf8,ACCUMULO-4774,ACCUMULO-4774 Made conditional writer thread into daemon
37c08d8e674a73174656f87e82d1b590ff771bcf,ACCUMULO-4766,ACCUMULO-4766 Fix Monitor table stats
44594962e9f14f98507a540d7be650425ca2beac,ACCUMULO-4756,ACCUMULO-4756 Small regex fixes for validating names
7a5500010efdeb2573b3c1d742caae8327349b55,ACCUMULO-4756,ACCUMULO-4756 Fix path param in TablesResource
815c2692a048be0dcbc67b8d05a4e4bc36312f57,ACCUMULO-4758,ACCUMULO-4758 throw correct exception when meta block absent (#334)
2f9c72ceb40e9f1df5fc98a01873848a34aa2066,ACCUMULO-4756,ACCUMULO-4756 Allow default tables validate REST (#331)
1a6e75ce5700b0e98a44e3ad19b5a3f1dc002bdf,ACCUMULO-4754,ACCUMULO-4754 Fix links to properties in 2.0 docs (#330)
49a8c62c9e09bd04ad60ef46e7e19ca85f94c9dd,ACCUMULO-4743,ACCUMULO-4743 Fix formatting
e189bfd30ed94831a9698aa4c0dbeda95f178fde,ACCUMULO-4745,ACCUMULO-4745 Fix broken links in monitor from Table.ID change (#326)
61242a780a7512339616fa165e5d7a61564479bf,ACCUMULO-4677,ACCUMULO-4677 Sanitize PathParam values in Monitor (#289)
f565b3aa48369c9b0df08f2786b433c30316b1a4,ACCUMULO-4743,ACCUMULO-4743 Replaced general custom with tserver prefix for cache config (#328)
c28e11c1079d2e1c6d68078b3328016569138fed,ACCUMULO-4669,ACCUMULO-4669 Use windowed statistics in RFile
ed313f7703b49343825be26c31f6eed81bc37d83,ACCUMULO-4744,ACCUMULO-4744 Fixed RFile API scanner bug (#324)
238e47116b16d7ea391860644a43f0dd44e75413,ACCUMULO-4546,ACCUMULO-4546 Fix StringUtils import
e738351fcdf2359997814c2cf105875702799265,ACCUMULO-4546,ACCUMULO-4546 Create default log message for table error (#327)
e875f01ed519100225bdf3a1550c40caccd8521f,ACCUMULO-4708,ACCUMULO-4708 Limit RFile block size to 2GB
f2c99b1e25e54307e5ba9156bf48cb5cacba9b8f,ACCUMULO-4721,ACCUMULO-4721 Document rfile-info in the user manual (#310)
c71b69892b25c770310d0349aa334ddc62890161,ACCUMULO-4702,ACCUMULO-4702 Fix unused import from previous merge
4750b880f05b0e584db108598fc9ace42e40dafa,ACCUMULO-4170,ACCUMULO-4170 Clarify ClientConfiguration javadocs
e7d2bfa6ae926da88a57ca9d7a68c1971c91baae,ACCUMULO-4170,ACCUMULO-4170 Clarify ClientConfiguration javadocs
6ead4740dbc24485b51d73d0a006d44bb2f52833,ACCUMULO-4716,ACCUMULO-4716 Don't cache blks over max array size
0241958ec3cd5e764b94a1fbd485fc859fdc393f,ACCUMULO-4713,ACCUMULO-4713 Correct handling min and max timestamps (#303)
da9de8686b6f986534db50b84635449e841f642f,ACCUMULO-4702,ACCUMULO-4702 Fix missing Guava in assemble
d765a2df8250fa77a5bfa57a4fa97a6605f4ffaa,ACCUMULO-4702,ACCUMULO-4702 Removed unused guava deps from poms
6e2e2e7c609d6b55122bf6afdf5308de9526342d,ACCUMULO-4702,ACCUMULO-4702 Merged up Guava changes from #299
2962878f4297fd81d4790f0be2e92ecb3fd69e82,ACCUMULO-4702,ACCUMULO-4702 Removed Beta Guava dependencies (#299)
b95db79ec7ed0ab937fd186b650e67f52b0e7ce4,ACCUMULO-4702,ACCUMULO-4702 Removed Beta Guava code where possible
b25f679af1ac2546b9a2c5d35006954a026bc7a7,ACCUMULO-4702,ACCUMULO-4702 Removed Beta Guava dependencies
d472fd2a43c30d2920fc4bf347ade5194ec84b41,ACCUMULO-4702,ACCUMULO-4702 Checkstyle corrections
8a966a0b1daf831c44b23569829b952b300c37b0,ACCUMULO-4702,ACCUMULO-4702 Replaced uses of Guava HostAndPort
b0016c3ca36e15ee4bdde727ea5b6a18597de0ff,ACCUMULO-4702,ACCUMULO-4702 Code fixes to work with Guava 23 (#297)
953c559c72eb6ccf484171e08a677c6db45bc33b,ACCUMULO-4686,ACCUMULO-4686 Formatting update from verify
7b35311b8a27ce3bc3a2c12a8e348ddb7c7cfde6,ACCUMULO-4662,ACCUMULO-4662 Refactored TableID in replication
c7117b8e6bc893b237cc6dd674ac02ffb78e116c,ACCUMULO-4686,ACCUMULO-4686 Fix upgrade process to set version in all volumes.
2cc577805d1cd2f6d3f8fe4c9250da1c3862480c,ACCUMULO-4686,ACCUMULO-4686 Fix upgrade process to set version in all volumes.
bafeece4adfb6ea14587ed49d39f3be9777065bb,ACCUMULO-4686,ACCUMULO-4686 Fix upgrade process to set version in all volumes.
b7a2029f474cabf2e48fe1c99475066bada78371,ACCUMULO-4700,ACCUMULO-4700 Set log4j appender threshold to ALL (#296)
1bf6620e070146f37772651bf5ae21cf27e40718,ACCUMULO-4699,ACCUMULO-4699 Fixed queued work key in replication (#295)
82a15686893cc2f1b26777664093fa1ac312248a,ACCUMULO-4696,ACCUMULO-4696 Cleaned up Main
d63181a0695d604c78d6cf43ca23a3cf25a1d4f0,ACCUMULO-4662,ACCUMULO-4662 Replace string with Table.ID
7619532e0543a98293f21bfe31ec62a9a2afb8da,ACCUMULO-3827,ACCUMULO-3827 set default store types for monitor ssl to jks
a1b39552059f25cd41e26ae569e77252b72bb6a5,ACCUMULO-4685,ACCUMULO-4685 Remove more warnings
f88f5cf75bc7589a83c9d1ca100d2b5e92942194,ACCUMULO-4685,ACCUMULO-4685 Remove unneeded code
cbce8101b8f5331f4551f588652b6232017875c8,ACCUMULO-4685,ACCUMULO-4685 Fix minor warnings
0f061b99cfae4fa9676ee5989eaf23682d1e61d9,ACCUMULO-4685,ACCUMULO-4685 Fix minor type safety issues
f78a5d96b29b43d0d50e6ca1fef632a6ed43f4ae,ACCUMULO-4685,ACCUMULO-4685 Fix bug in FileRefTest
818e56bb54499079bf86ad80e5e619b248d6ff69,ACCUMULO-4602,ACCUMULO-4602 Deleted AssignmentThreadsIT
87e5780d7f6a8ed018c77efb8415f5834ff4763d,ACCUMULO-4602,ACCUMULO-4602 Improved RollWALPerformanceIT
520d23d85dfce9297bab887726322861163a1fb2,ACCUMULO-4602,ACCUMULO-4602 Fixed ChaoticLoadBalancer edge case
f81a4b12b022ef0f78f5ec06a18d7a97b992f676,ACCUMULO-4602,ACCUMULO-4602 Improved Test to stop quick fails
b7d9be0954accdf6ac91cd541f4ed9e60e49f04a,ACCUMULO-4602,ACCUMULO-4602 Improvements to AssignmentThreadsIT
41b792da3b5168e629af65b96c24da24e292f366,ACCUMULO-4674,ACCUMULO-4674 Enable Native map before configure
4cffe02905527954a031b0994f68bce6faf670f5,ACCUMULO-4674,ACCUMULO-4674 Fixed ExistingMacIT
5abce363a85524103bb51d56d4f036b8d1f06e3a,ACCUMULO-4675,ACCUMULO-4675 "accumulo-util gen-monitor-cert" doesn't work
efc5a98bb4f27503bf82328d2e68d29c04860d14,ACCUMULO-4665,ACCUMULO-4665 Use UGI with real Kerberos credentials
722d5eb5c4c2ebb61628abe8d018e3a0e7bc2a6d,ACCUMULO-4662,ACCUMULO-4662 Fix ambiguous table reference
f630f6a62e69f82b9782c1d429c0a8bbe598ad36,ACCUMULO-4660,ACCUMULO-4660 Remove * import (addendum)
6f187823e4309ed79d6fa3f24b049731126f5263,ACCUMULO-4660,ACCUMULO-4660 sanitize incoming values from HTTP parameters
606cacee016af1927e299163ae508d3c4662efac,ACCUMULO-4651,ACCUMULO-4651 Fix PermissionsIT
f110b584ccb22e391e4ab044a71cc42b69ae6945,ACCUMULO-4605,ACCUMULO-4605 Remove hard-coded commands from Main
94bb593ba1dcf545cfc2cf39f8ef8b360b064dd2,ACCUMULO-4619,ACCUMULO-4619 Fix addSplits exception regression
15b9c3eec1160ea3a121f157532151df0d2135f2,ACCUMULO-4652,ACCUMULO-4652 Fix SLF4J error in build
de83e61c7f965b6f83482c6070b483bd1835b5a6,ACCUMULO-4640,ACCUMULO-4640 Fix broken SiteConfigurationTest
e4a381de90e1bb06ea49ce189166272ceac87f54,ACCUMULO-4649,ACCUMULO-4649 Fix AuditMessageIT
4effd0e9a757b513e62a3c8dd9637922e2d9742e,ACCUMULO-4640,ACCUMULO-4640 Fix SiteConfiguration parent
54c82dc90b028d829d0dd8fce7b7deaef7becee8,ACCUMULO-4634,ACCUMULO-4634 : Appropriately implement the mocked out methods of MockIteratorEnvironment per the interface specifications.
5f6882fc28bfea9cd48afef174dcf957eefde210,ACCUMULO-4506,[ACCUMULO-4506] Add a timeout to a replication RPC call
771475ad5c7f76c01dff9bdea78c1931688433d1,ACCUMULO-4633,ACCUMULO-4633: Added check to prevent division by zero
6e9f1f728eaf369e2d2ac696f7bfe6d465407f1b,ACCUMULO-4365,ACCUMULO-4365: Configured ConditionalWriterIT tracer span min to 0
b4ed93854aa28a1152f80a5f38e5efec247f2d9a,ACCUMULO-4365,ACCUMULO-4365: Configured ConditionalWriterIT tracer span min to 0
1061fb55315fd0184ef79d9e31c3aa9b0aad7fd2,ACCUMULO-4365,ACCUMULO-4365: Configured ShellServerIT tracer span min to 0
ce4017884231d5111baf9856038ad42a4ff2ed4c,ACCUMULO-4631,ACCUMULO-4631: Moved junit unusedDeclaredDependency to maven-plugin pom
58076bf5213c93b9aad686ab4784106d443e6544,ACCUMULO-4631,ACCUMULO-4631: Added Junit dep to maven-plugin and unusedDeclaredDependency
6b2e430dc0a00039be63a9eceb49cdc75a866ef3,ACCUMULO-4576,ACCUMULO-4576 Suppress warnings from deprecations
8c0f03ac2d8e06b220e2882d54914f2034625e15,ACCUMULO-4619,ACCUMULO-4619 fix split hanging on Error
6e3421708a990c055c137033707ca11a0ceefaa6,ACCUMULO-4616,ACCUMULO-4616 Removed unused variable in accumulo-service
4ba5faf49d723dabde6916bed956a0459dccf5ac,ACCUMULO-4482,ACCUMULO-4482 Mention snappy compression in docs
b4f86d978c3abb7a1f9e448f49c1598afe0d8cf9,ACCUMULO-4613,ACCUMULO-4613 Verify directories in accumulo-env.sh
f02b731a2b948266001cddb0c2ad5f1f5d25152f,ACCUMULO-2806,ACCUMULO-2806: changed permissions of /accumulo to 700
80373557b4d39c10b3dd62dca5d13d7ed0290b5d,ACCUMULO-4600,ACCUMULO-4600: Fix to properly read from accumulo-site.xml
de80cf53b66f58a9a99d8a9dd54b5a716fa8df44,ACCUMULO-4597,ACCUMULO-4597 fixed bug in rfile-info
192b4e81a7a93eb85e35adb4e10cd9631781583d,ACCUMULO-4593,ACCUMULO-4593 Move metrics config to templates dir
3f935e017799987c3ac9c90be5f608af1f99cb24,ACCUMULO-4594,ACCUMULO-4594 Fix Kerberos documentation
c3a0d1d5e2f810ebcda346977009ab0fd1bd34f7,ACCUMULO-4590,ACCUMULO-4590 Use JSON.parse instead of eval
a9bf10ffff62f25d5810816db23ec80d6b06f61b,ACCUMULO-4519,ACCUMULO-4519 regenerate thrift
025aacc9fde81d1d51394126fd550f07a71f260e,ACCUMULO-4519,ACCUMULO-4519 patch from Yudong Wu
f4120422bcaf8466c5c49054761c4bc10f8fba68,ACCUMULO-4577,ACCUMULO-4577: Fix merge error
78176e5948bccb2501184bbffad31a8d7d7e6603,ACCUMULO-4577,ACCUMULO-4577: modified exception thrown by Tables.getNamespaceId
5f664cd76d64d8fb11a80be7a16f1988a92af0d3,ACCUMULO-4578,ACCUMULO-4578 fixed checkstyle issue
6d8a5fa59248ad400fea01f66cd290fbe2da03e6,ACCUMULO-4578,ACCUMULO-4578 added some javadoc
db84650e7454b8354a28d0dcda8da1235a6ea175,ACCUMULO-4578,ACCUMULO-4578 release namespace lock when compaction canceled
7b9a11ad4d12f4572f606eaaed17f8fe78720e05,ACCUMULO-4575,ACCUMULO-4575 Fixed concurrent delete issue in FATE ops
ff134d2c63b47a4d496bb6dfe51b96cbbcadd55f,ACCUMULO-4576,ACCUMULO-4576: Always use the most current tablet server information to make assignment / balancing decisions
df400c59efd2274d8714cad4c9d3648bb0845c50,ACCUMULO-4575,ACCUMULO-4575 Fixed concurrent delete table bug
95be9f3c420b28e9dfcc11bc05ef05c3cf47a74a,ACCUMULO-4572,ACCUMULO-4572 Avoid blocking when looking for files w/o sample
6d8f4114526fe54fb8da4ee2a8669fe50785433b,ACCUMULO-4570,ACCUMULO-4570 Use a boolean for active service instead of the ZooLock
cd4cd68f724b55af05bef73e84432346ec899140,ACCUMULO-4550,ACCUMULO-4550 Removal of examples breaks ShellServerIT
c3d8703296718141e86d5d63a27f235d6f98f1ce,ACCUMULO-4541,ACCUMULO-4541 Ensure grep output gets flushed
17d26bda481a5b62295d9c5f56b58680005d6b14,ACCUMULO-4535,[ACCUMULO-4535] Fix NPE in HostRegexTableLoadBalancer
3bd701b883492f06766631af30e7b08f14d3454c,ACCUMULO-4534,ACCUMULO-4534 Disable external entities in SAX parser
47b57f7300ae5d1df9536cf07d99c83bfb8e2af6,ACCUMULO-4533,ACCUMULO-4533 TraceServer shouldn't abort given problems with trace table checks.
3c4544144a78904198b6795828c176e806b64e09,ACCUMULO-4505,ACCUMULO-4505: Another fix for shell errroneously reading conf
c02efeab23dc45da4b7ee69c0e73a2ea1144bfb4,ACCUMULO-4521,ACCUMULO-4521 Usage of accumulo commands should in 3rd person
8aede75ae7ac94a8255b3e6e64e46ea14b1c527d,ACCUMULO-4517,ACCUMULO-4517 Remove no-longer-present Accumulo jar from tool.sh
a361f63d62272b161365c400e476b04272c21906,ACCUMULO-4505,ACCUMULO-4505: Fix for Shell erroneously reading accumulo-site.xml
32fd1004a413607327bf6b2f16e88eeffa471955,ACCUMULO-4504,ACCUMULO-4504: Improved the help for Shell zookeeper options
0d41ec6e64f8c661b476ba74e1670aabd21d85b2,ACCUMULO-4489,ACCUMULO-4489 Monitor login for access to trace table should fall back to general kerberos keytab when trace keytab is not set.
9e236f289679e950e181db7c14b7f54042d1bb14,ACCUMULO-2278,ACCUMULO-2278 Return value from in.read() should be checked
83fe980f43864a951f5aa5222ab7428a0d4853ae,ACCUMULO-4483,ACCUMULO-4483 Added another test case
1221381c4d89e124285ca54f7e934afc93a6921f,ACCUMULO-2724,ACCUMULO-2724 Changed option for threads to --numThreads.
8255fc054ec58d512fd9189f96c590dd66d2f10a,ACCUMULO-4488,ACCUMULO-4488 Fix numbered list (addendum)
a17390db11c69dea0c7f1fbf75c9b28f8e1d561c,ACCUMULO-4488,ACCUMULO-4488 update kerberos section in the user manual to fill some gaps.
f7989c67847d623951d657783cea263f6041987b,ACCUMULO-4483,ACCUMULO-4483: Don't modify the source Value in MemValue.decode.
52f53f56e32c10f81017205842f134736dfa9759,ACCUMULO-4454,ACCUMULO-4454 Auto-determine version for manual
7fe029fb07b26b617c5209f2b0b9b63696a8fc5e,ACCUMULO-4478,ACCUMULO-4478 Use correct HttpURLConnection import
31590b8c21ba692d4bcb48670b897d827068a6ed,ACCUMULO-4474,ACCUMULO-4474 Unused import
b19de71ba11c08606bc5dd7b667e2de1bd6c1652,ACCUMULO-4476,ACCUMULO-4476 User manual references old version
ab2bf631f8e9dc2e8ba4947fb4be16afcfceddec,ACCUMULO-4475,ACCUMULO-4475 User manual references 'admin start'
c369cdc35b149d38e3d0dacc495e76619d84c2ac,ACCUMULO-4474,ACCUMULO-4474 Remove unnecessary import (addendum)
450cae509b854b418e79376772b27de9e8895031,ACCUMULO-4474,ACCUMULO-4474 Make ExistingMacIT more deterministic in verification
e76f3a236a8c91553974a8f1981d838de2933ba2,ACCUMULO-4471,ACCUMULO-4471 Typo in user manual replication instructions
deb5edd8df6161a3ba30a0c83dbc240096c1721e,ACCUMULO-4469,ACCUMULO-4469 ConcurrentModificationException while running MultiTable.xml node in Random Walk
6a677adafe0fe03a6a331d281c1a27b4854f94e7,ACCUMULO-4467,ACCUMULO-4467 Ensure commons-math3 is on the classpath for RandomWalk MR jobs.
985651b48451025db8a1bd00e79730f9d10ded6f,ACCUMULO-4467,ACCUMULO-4467 Ensure commons-math is on the classpath for RandomWalk MR jobs.
e07f6858e54b2fefab89305e24e14546fde592aa,ACCUMULO-4444,ACCUMULO-4444: added check for null token in ConnectorImpl
108f4f399e02638552cd8d655561abeed1765a0a,ACCUMULO-4459,ACCUMULO-4459 Fix compile with hadoop 1 profile
923c87e2fbdfd49409e8099293cc87371da8f6fd,ACCUMULO-4458,ACCUMULO-4458 addendum for 1.8
48733ce8cb9e89f1243e5e46d792010900086c7b,ACCUMULO-4458,ACCUMULO-4458 reduce contention on config retrievals.
4c040799f48c21c5f157fabcab8fde5259b6c7ed,ACCUMULO-4391,ACCUMULO-4391 Remove unused field
200be5f29a8150b9cf2dd2042cfc1d79345ac23e,ACCUMULO-4451,ACCUMULO-4451 Fix line-endings
0ecc47161cc5b019f856dccd78bec48c4ba70e13,ACCUMULO-2972,ACCUMULO-2972: correction to description for instance.secret
2165dde60827a1b7a9dc7c4c78f8e183bc04b104,ACCUMULO-2972,ACCUMULO-2972: fixed description for instance.secret
3b6944180b4df9d0e56c2296d967b0ec880bd4bd,ACCUMULO-4391,ACCUMULO-4391 removed extra closed check
3c8bc120b1527eb0cba5390da8e57eb947734af8,ACCUMULO-4391,ACCUMULO-4391 Added appropriate synchronization to allow RFile.Reader deepcopies to be used in separate threads. Added a test case which forces at least one of the race conditions. The remaining conditions have been tested on systems that demonstrated these issues.
768a73c504d817ee9697dd249987d0f29189190c,ACCUMULO-4428,ACCUMULO-4428 Changes for the backport to 1.6
b0181fe5e5858a9f93c69f8c54ff0b8102484de4,ACCUMULO-4428,ACCUMULO-4428 Stabilize the new GarbageCollectorIT
9d4a46a0c207bf89372aba585edbb65d4e141ee4,ACCUMULO-4428,ACCUMULO-4428 Fix state of GC firstSeenDead map
ebd42e2abb6a591a6806adebd60f2a59dd160621,ACCUMULO-4445,ACCUMULO-4445 Fix broken bin/accumulo script
a4fdcf20568d75115e0d46a073d55d797d7402bf,ACCUMULO-4434,ACCUMULO-4434 Reduce stringency on success condition for CompactionRateLimitingIT
f1ffe5918944e2d3f82ec9a6a5b4bf372698fa3f,ACCUMULO-4436,ACCUMULO-4436 Make sure that all processes get tagged for cleanup that are executed via MAC
8a3cc4f04c61847a7dcc9abd24a83c072a35b00f,ACCUMULO-4428,ACCUMULO-4428 Stabilize the new GarbageCollectorIT
9edda3215974d7ee284ecfa08b69fcd1ef686d19,ACCUMULO-4428,ACCUMULO-4428 Fix state of GC firstSeenDead map
602799787470c9d2d8524242889ea59f12e50581,ACCUMULO-4425,ACCUMULO-4425 Fix VolumeIT.testDirtyReplaceVolumes
2be85ade34c413cc32db838e6125e582b829ef03,ACCUMULO-4421,ACCUMULO-4421 Ensure that TraceServer launches the Kerberos ticket renewal thread
d66a8d08627e98e9bbdd2bd0b1ab4f4658a84d9f,ACCUMULO-4421,ACCUMULO-4421 Check if the Trace User is expected to use Kerberos before attempting to login to Kerberos as the trace user.
40d5a722b3346f96ed6f982724513e0f3fa8c87f,ACCUMULO-4414,ACCUMULO-4414 Decrease log level on vestigal debug information
679a1c3eb9013d8bb0640a617392f921f096b158,ACCUMULO-4422,ACCUMULO-4422 Initialize logging as first step in server initialization.
82f173496b2d71b9cc586b4870169ca64f89cdd6,ACCUMULO-4163,ACCUMULO-4163: change exception handling
8b24701740224e114a833bfb08f10ad2708b9cf6,ACCUMULO-2971,ACCUMULO-2971 Fix missing final keyword
a0c74ee915798c709c0a559732bed3cfcb6d0f39,ACCUMULO-2971,ACCUMULO-2971: multiple improvements for ChangeSecret tool
a226233d7eb0287f8c5b61e1727d73fc13f85be1,ACCUMULO-4412,ACCUMULO-4412 Check proxy process when client fails to connect
1e087bad3681e0f1fc9d7d35a6ed753a0435a181,ACCUMULO-4405,ACCUMULO-4405 Prevent ThriftScanner from waiting Long.MAX_VALUE millis
09c38326f6f4732afad0c0779b1fc0e242bf4ce3,ACCUMULO-4403,ACCUMULO-4403 Use FQDN and all hostname aliases
cda493bd5636cd7523f4e0168f1174431a837007,ACCUMULO-4401,ACCUMULO-4401 Restore original conditional to avoid infinite loop
9bd3306f03fbd6b910e54df4e8e4834e2ee89a81,ACCUMULO-4399,ACCUMULO-4399 Escape OUTPUT_DIR target in Makefile
fc9bd0719518e7822f84472e495e1ef96f58d836,ACCUMULO-4399,ACCUMULO-4399 Handle files w/ spaces in Makefile
3fded56a1793839364ddb9ce8be937e03669ece3,ACCUMULO-4362,ACCUMULO-4362 Fix TabletStateChangeIteratorIT
10da04b55d1c078e3e0a6f092d85a86c825ec609,ACCUMULO-4397,ACCUMULO-4397 Fix FastBulkImporIT timeout
9038d8b3a36e7189fbdedfbbb950c7b1f43b2b7d,ACCUMULO-4391,ACCUMULO-4391 Use a closed flag
6ff35f0f013497871df22acc842341ea7163a5ab,ACCUMULO-4391,ACCUMULO-4391 Added appropriate synchronization to allow RFile.Reader deepcopies to be used in separate threads.
5957c2234e9c577ef65c1e0fb44c7c25874059e0,ACCUMULO-4391,ACCUMULO-4391 Added synchronization around the available() call in the BoundedRangeFileInputStream to allow RFile.Reader deepcopies to be usable on separate threads. Added a test case which excersizes RFile.Reader deepcopies across threads.
1bba1eec56be9a1f4e26146abfa0b637b4c535e7,ACCUMULO-4381,ACCUMULO-4381 Removed unused variable
cfebe5618fcbcca530cb52a1ed04a3ec201f6f8f,ACCUMULO-4388,ACCUMULO-4388: Move location to obtain zoo session.
d074eff92883cbaf62158d79d182f76a623fe6f8,ACCUMULO-4387,ACCUMULO-4387 fix javadoc issue
7a47b187e0958f07425867f97012f7b2dc66a6f9,ACCUMULO-4374,ACCUMULO-4374: Changes to Shell to fix ChangeSecret tool
612ede6960503a8ffef0d30bd73503015c52274d,ACCUMULO-4374,ACCUMULO-4374: Changes to Shell to fix ChangeSecret tool
1aceaa01453ebc1709eac1f3eb3908280310a78e,ACCUMULO-4381,ACCUMULO-4381 Cease use of Process#isAlive()
a094324a5b7ceebaf7f3e5c656beeebc0710fbc4,ACCUMULO-4128,ACCUMULO-4128: Use setshelliter and profile name in scan commands
2c8838899531080adfdb33ba75f25f4cdd643963,ACCUMULO-4128,ACCUMULO-4128: Use setiter instead of setscaniter as it does not exist in 2.0. Added more output validation in the test to catch this in the future.
4cee43691dc191236682db1894854337812419bb,ACCUMULO-4110,ACCUMULO-4110 clean up the WALSunnyDayIT
a8f804e9e8d0bfe1ff93065e4714483a262440de,ACCUMULO-1604,ACCUMULO-1604: added check for negate option in ColumnAgeOffFilter and new test in FilterTest
791fbd6ba17aaca1d19f57b20860930c81c99bf0,ACCUMULO-4372,ACCUMULO-4372 Fixes synchronization in CompressionTest
a8d1acd4bb34947ac49830e5a671e3f528ca2f7e,ACCUMULO-4372,ACCUMULO-4372 Fixes synchronization in CompressionTest
d66425496e9fd2792c9fba9ade92dc701873e74a,ACCUMULO-4373,ACCUMULO-4373 Fix compat w/ commons-configuration
0e4ac2f4c8939d86b61f5a3c94323c65766a4481,ACCUMULO-4371,ACCUMULO-4371 Compare objects of the same type in WALSunnyDayIT
8949e3d83ecf534904ce3df2b515e10234cd3cb0,ACCUMULO-4370,ACCUMULO-4370 Replace bounded checks for replication table state with unbounded checks
