e7437141fa6a78fa823f7791019a662d592f3416,ACCUMULO-1264,ACCUMULO-1264 fix edge case when looking at the root tablet
37f5f60dfa778b82f540256fd3e8df03fd55347c,ACCUMULO-1264,ACCUMULO-1264 put delete markers for the METADATA table into the root tablet
b536e64b42a0e8f37f2704a3cbd0d976fee2adbc,ACCUMULO-1264,ACCUMULO-1264 put delete markers for the METADATA table into the root tablet
f37030d371467407db98f9830acada9d08b4f2b1,ACCUMULO-1107,ACCUMULO-1107 Fix typo introduced in previous commit
32d1199ad41936357df3d592fca1084f304eff5a,ACCUMULO-1107,ACCUMULO-1107 Build rpm and deb better. Made rpm noarch.
73e22245bf0c6ffc5fa54f26b0ca50dbed30b977,ACCUMULO-1244,ACCUMULO-1244 fix log4 lookup for hadoop2
79fc606d0b34456b56a811cd786e611272b5430a,ACCUMULO-1250,ACCUMULO-1250 Trivially fail the build when thrift profile is active
4c3f3c5063765ecb4e1d1dd833306aa0ff063715,ACCUMULO-1265,ACCUMULO-1265 Fix 'mvn compile'
512788346031550ceb555dee37b6ef32a003c6ac,ACCUMULO-1264,ACCUMULO-1264 tweak the scan range when looking for !METADATA tablet consistency check; add !METADATA table merge/split to the randomwalk test
612fd01c5340167328661e271e9c58656832cc68,ACCUMULO-1264,ACCUMULO-1264 tweak the scan range when looking for !METADATA tablet consistency check; add !METADATA table merge/split to the randomwalk test
87142b00f18d024a416bf38626c0a0ad6650d168,ACCUMULO-1244,ACCUMULO-1244 Make more libraries provided, because they must be. So, we'll depend on the version given by Hadoop. Remove all provided jars and source jars from lib directory.
6760837112ca003ae7c6268a44ab2241271c6681,ACCUMULO-1044,ACCUMULO-1044 added unit test for metdata bulk load filter
476816af813bc92a4acc8b5d3783d1a49708839a,ACCUMULO-1044,ACCUMULO-1044 added unit test for metdata bulk load filter
4de3d7cdf9a66bd75ca86d8f7697e1d55feb6c8c,ACCUMULO-1044,ACCUMULO-1044 fixed some issues w/ metadata constraint bulk flag check, made the check more strict, and added a lot test for it
e00de28902c998519516a2ab94e0b78551dc88c0,ACCUMULO-1044,ACCUMULO-1044 fixed some issues w/ metadata constraint bulk flag check, made the check more strict, and added a lot test for it
e57c0a6e2d11d4c18a1d894ae21a66a9204d0a05,ACCUMULO-1044,ACCUMULO-1044 make metadata constraint bulk flag check for column set when new split tablet is added
f75c1c387adc9666519c106f38e51b45b221bf6f,ACCUMULO-1044,ACCUMULO-1044 make metadata constraint bulk flag check for column set when new split tablet is added
89abe67cc2731c71ecee32d6c5e403389876f66b,ACCUMULO-1044,ACCUMULO-1044 fixed bug in bulk load filter
274517e58a288395f26df2e146575b61efa615dc,ACCUMULO-1044,ACCUMULO-1044 fixed bug in bulk load filter
76f5667a5ed2d48448d3a3c64639ba11381a5982,ACCUMULO-1044,ACCUMULO-1044 fixed bug in bulk load filter
3e37e58889188020fe38039528eb261f28ed3ae9,ACCUMULO-1243,ACCUMULO-1243 Added apache header
202f2778444d14b6bb7b4a0de755d7a50dd6b3ed,ACCUMULO-1243,ACCUMULO-1243 Added apache header
5ab98b87e16c5811988309e796364a2a6d06d3da,ACCUMULO-1243,ACCUMULO-1243 Made tablet loading code only load one tablet when recovering a split. Made code more strict, it will only load an exact tablet. Made load code roll back splits that have started, but did not create a new tablet. Added some more test.
ed996b84d6409ec67a6af94db7641451243f2fba,ACCUMULO-1243,ACCUMULO-1243 Made tablet loading code only load one tablet when recovering a split. Made code more strict, it will only load an exact tablet. Made load code roll back splits that have started, but did not create a new tablet. Added some more test.
096371a818a6160aa7fed456e8dae6d92f470a07,ACCUMULO-1044,ACCUMULO-1044 clearly define "transaction should stop" and "transaction is complete"
82c5fbf6dcac0425649dc07f7493b9e21b252ec7,ACCUMULO-1044,ACCUMULO-1044 clearly define "transaction should stop" and "transaction is complete"
2e7810c980781228e4c94cfa537cd8bd352e41e5,ACCUMULO-1199,ACCUMULO-1199 add another check for table not found
e11dfd1cacd5768bf4b24d513049ed94dfb8cba8,ACCUMULO-1199,ACCUMULO-1199 add another check for table not found
8f87860d976f44c77969915a2aede1fa64922c9e,ACCUMULO-1044,ACCUMULO-1044 clearly define "transaction should stop" and "transaction is complete"
527c6876288e075c249b8652705afef1691e5984,ACCUMULO-1199,ACCUMULO-1199 added a lot of table not found checks
4b94900d0348446cb23a788a772d60121c090e47,ACCUMULO-1199,ACCUMULO-1199 added a lot of table not found checks
56887c3b04120acb61ff1e8ab1fb3adfa4d5139f,ACCUMULO-1253,ACCUMULO-1253 Fix build of docs/config.html; strike-through deprecated properties
8c8afe4ad833bb68a78cbde11b1a7100afc14667,ACCUMULO-1252,ACCUMULO-1252 remove loaded files outside the threadpool
c4f131c656e9b8138c91df0cb17a4407f4343345,ACCUMULO-1252,ACCUMULO-1252 remove loaded files outside the threadpool
cdcc7c2f51f6e3ffae578501150ce8999955f8b0,ACCUMULO-1251,ACCUMULO-1251 applying Adam Fuch's patch to allow clients to recieve large messages
0ee7e5a8be17ea427a9046ea2fa83db4e2297f44,ACCUMULO-1239,ACCUMULO-1239 make balance checker triple-check
6a501c090876bb378ae671711f894f5f2845d652,ACCUMULO-1238,ACCUMULO-1238 throw a better error than permission denied when a table has just been deleted
846a1b40a5edcd428c3de2a8f2f49f1ec2c56f31,ACCUMULO-1234,ACCUMULO-1234 do a local check for classes that are only used locally
e29dc4f5278747cb7f18fb6dc5a9751df63af1f0,ACCUMULO-1190,ACCUMULO-1190 make update a oneway call again
69508d1ddb522cf21eb0dfc2a980f5c380a03154,ACCUMULO-1235,ACCUMULO-1235 load properties if we're loading an unfinished split
5fd2dc7efe709e97e3191780420d1152950f1f49,ACCUMULO-1118,ACCUMULO-1118 merged shelltest fix to 1.5 branch
7d5698b9dcbf260d024fa58ebbbf99c67e7f0dff,ACCUMULO-1190,ACCUMULO-1190 applying Corey's patch
43ade543e36f8c2695b24658b876dcb0a5d959fd,ACCUMULO-1118,ACCUMULO-1118 re-introduce centos fix for ShellTest
0f1202c8f874ea3ecb4b9ecd3a4916808290fbf5,ACCUMULO-1233,ACCUMULO-1233 retry znode child scans
aa4f6f2686c395da685b38c29cdfd85925b5a118,ACCUMULO-1231,ACCUMULO-1231 use system credentials all the time
ea2f9856855530f8a3381fe5ccba78d89b8d9f73,ACCUMULO-1044,ACCUMULO-1044 add a metadata table constraint to require the bulk load transaction to be alive when writing the bulk-loaded flags
9528e8c926204502c188bcf1067f672a706b7695,ACCUMULO-1214,ACCUMULO-1214 document delay between set/get properties; loosen the test to allow for the delay
b426539b830d75fc677868025a468e37ccd47af0,ACCUMULO-1211,ACCUMULO-1211 made formatting more consistent
2aedcefcbf201d40a130d2e9f141cdb573c66ec7,ACCUMULO-1180,ACCUMULO-1180 testing DARCH=both
7fd6a9452c9ca66feb9576da517c2f03ffc1ad47,ACCUMULO-1205,ACCUMULO-1205 Stub in an onload for the "Show Trace" page which display:table-row's any trace line which has the 'addl data' checkbox already checked.
d7aab97d101991a29aa996eb29437d652a4d8317,ACCUMULO-1214,ACCUMULO-1214 fix method name conflict
265947d29688d44508da19a4fdf1659fcc9539b6,ACCUMULO-1214,ACCUMULO-1214 fix method name conflict
6b5ce04f53764efc8602f294acb848589e79752f,ACCUMULO-1214,ACCUMULO-1214 invalidate the zookeeper cache when returning results to clients
5eeabd33487c82e3e8fef8bbc31035f277a6ce62,ACCUMULO-1214,ACCUMULO-1214 invalidate the zookeeper cache when returning results to clients
f51b871e11caee80bba96657ad8c64310e811946,ACCUMULO-1062,ACCUMULO-1062 disabling testParallelWriteSpeed
7268940897ff896616e8e5e49deb00e396ea73bf,ACCUMULO-1062,ACCUMULO-1062 disabling testParallelWriteSpeed
33ec4cc02b19251a297673905fc82bbe201dee77,ACCUMULO-1213,ACCUMULO-1213 master did not transition from HAVE_LOCK to SAFE_MODE
9c27e159efce4dfc58e2ee68488eceef1092fa15,ACCUMULO-1213,ACCUMULO-1213 master did not transition from HAVE_LOCK to SAFE_MODE
210593a0980ca74b31a05ae50d997efdf5c2d3c7,ACCUMULO-1213,ACCUMULO-1213 master did not transition from HAVE_LOCK to SAFE_MODE
ef0798cafb96d9526ca61869ae34ac4dc81f3b9a,ACCUMULO-1206,ACCUMULO-1206 Override compareTo to sort the trace entries by start time instead of their toString(). Add a simple test to make sure the Comparator compares correctly.
cf1c43fb0ec5525b50a736826abe6d3f4d7721bf,ACCUMULO-597,ACCUMULO-597 Made graphs on monitor page respect, and show the local timezone. Can be overridden by setting the TZ environment variable in conf/accumulo-env.sh
2c06f5dab35992fb2e7287c15813ead3b490ba94,ACCUMULO-1161,ACCUMULO-1161 - fixed logic error for backwards compatability. Also, more descriptive error messaging.
7865fb2e3d01cdc85973903c37c3289981849bc4,ACCUMULO-1210,ACCUMULO-1210 remove stray println
610bb4c9a8deee9fcea22e99be89120a2d0f35bd,ACCUMULO-1204,ACCUMULO-1204 fix "scansessions" entry in json
aa6b430985866bfc22fc6009ec6523ef921f051d,ACCUMULO-1010,ACCUMULO-1010 removed logger zookeeper entries during upgrade
5ada9e4d0661208a3c46532e3d18a612c2a21331,ACCUMULO-1048,ACCUMULO-1048 cleaned up master lock acquisition
9476b8775f48dfcbc67b06ccc07719e09d7469fe,ACCUMULO-1192,ACCUMULO-1192 applying Kevin Faro's patch to fix du on an empty table
17d155e8eeae41d264e7e9bd1869b748d957fa60,ACCUMULO-513,ACCUMULO-513 made master always form a new connection when getting tserver status info
52f7548ab4c7a7c2cf3e59a474ce719e5631efa2,ACCUMULO-1191,ACCUMULO-1191: Move thift generation into 'thrift' profile.
4b163a996e090550eb6a29e6d63eb0abb5b5853c,ACCUMULO-1071,ACCUMULO-1071 stopped automatically populating conf dir in bin/config.sh
d6fd0c7c007d1ad7f49ef3f716b23af4f46bc38d,ACCUMULO-1062,ACCUMULO-1062 I suspect large number of threads is making the apache build servers fail our builds
336c12b8a03b2f97cfff5fdfd319a9a21e9d865c,ACCUMULO-1039,ACCUMULO-1039 Added info about table creation and versioning iterator to docs.
ddfdb215ddf901d66f930b64beb70d236b962d45,ACCUMULO-1040,ACCUMULO-1040 fixed code in documentation
1e76165cdaf292c2a4b380b2fc4f4935b788ccc5,ACCUMULO-1153,ACCUMULO-1153 guard against an index-out-of-bounds exception
5eb69b78e30f42d199c2b330195664034e384bf3,ACCUMULO-1153,ACCUMULO-1153 guard against an index-out-of-bounds exception
df4748b08f325e02e3e649768cf406f40bccf0d4,ACCUMULO-1153,ACCUMULO-1153 do not bother warning about directories we know may not exist
7ade3bb60301f00d7d9492df0a2850197f4bebaa,ACCUMULO-1153,ACCUMULO-1153 do not bother warning about directories we know may not exist
533237bffb5c828a4dfecad10742018ed0f00546,ACCUMULO-1144,ACCUMULO-1144 merged patch from Kevin Faro
c9a0083481b1552398e9df5e71df38bab4ffd98f,ACCUMULO-1189,ACCUMULO-1189 fix up exceptions
d948eec33e039609c91225d13323ebdbc27942b4,ACCUMULO-1189,ACCUMULO-1189 fix up exceptions
09d5c60af701e9c09161c1762f00f164981f38f4,ACCUMULO-1184,ACCUMULO-1184 - simple fix for reset security bug
742960f1d364a0a195bfd6df886ead18887ed196,ACCUMULO-1183,ACCUMULO-1183 applying patch from Corey Nolet
7e20dc14a9f8311241ea06b75cf1de4c6b0a94ca,ACCUMULO-892,ACCUMULO-892 made stopAll flush tables
6ce1788cee6234059168c80dd1802ad3742a77af,ACCUMULO-727,ACCUMULO-727 retry more times
ab76c46e72ff3820022e86f76e10ac228148626a,ACCUMULO-727,ACCUMULO-727 add exponential back-off when bulk loading files
f72825d5bf25b66300d6720e9b112349b7aca2f7,ACCUMULO-1172,#ACCUMULO-1172 increased default metadata table split threshold
48e331cc2d55a37421b5dd7bbb45e91657ea811f,ACCUMULO-1056,ACCUMULO-1056 Made getSplits more robust and renamed it to listSplits so it could throw another exception
9f03eb0f8739fc70ca829e3f0fdd7e7fa8ece9d3,ACCUMULO-1056,ACCUMULO-1056 Made getSplits more robust and renamed it to listSplits so it could throw another exception
3bc8a49b3992400e808366c67d9a08bc50002a72,ACCUMULO-1178,ACCUMULO-1178 revert unintential check-in
6fbc8cb15b0699ef3a339603f763e0c1d7c02a05,ACCUMULO-1178,ACCUMULO-1178 update presentation
11f4b4ba4d1a3b405e197f892715b0baf12c4133,ACCUMULO-1173,ACCUMULO-1173 reverting setting thread state
8f460cc13359e85e1753c16d3d97db4093b81a33,ACCUMULO-1173,ACCUMULO-1173 reverting setting thread state
ceb4a1b86563a0ea773506c7183da9ae0fe470dd,ACCUMULO-1173,ACCUMULO-1173 reverting setting thread state
d55d24c0f1ecd2edab8dfd0d2a6e0bc483575d86,ACCUMULO-1173,ACCUMULO-1173 reverting setting thread state
137239cf898389153960e6234a287d5a2c3f8798,ACCUMULO-1173,ACCUMULO-1173 ensure that threads serving requests are Daemonized
9df8895f87eacb850b883ed5d744ab1c3d216f63,ACCUMULO-1173,ACCUMULO-1173 ensure that threads serving requests are Daemonized
1ec04ca9a0d6a2c910e18abedbe3853d2ec539a4,ACCUMULO-1173,ACCUMULO-1173 ensure that threads serving requests are Daemonized
94313dc5e476d3027ed7e98f37352c4ab10558aa,ACCUMULO-1173,ACCUMULO-1173 ensure that threads serving requests are Daemonized
f0f62896f7c421eb3a9b57ab93251219714c59cf,ACCUMULO-1173,ACCUMULO-1173 disconnect events do not set a path
b5055960cd61802c765fda9acfa25a2791f8d597,ACCUMULO-1173,ACCUMULO-1173 disconnect events do not set a path
a6275ef269ca0aca9bb2ea6a101fc3224c2795ca,ACCUMULO-1173,ACCUMULO-1173 disconnect events do not set a path
ed0be7ec42afb702ec8fec037d9238854cfb7850,ACCUMULO-1173,ACCUMULO-1173 disconnect events do not set a path
f265bdf58e3fb60a98e0745a03a7d6eb9354688d,ACCUMULO-1171,ACCUMULO-1171 revert accidental checkin
21c1154257eb107c4a351522c91d7cca34c5768c,ACCUMULO-1171,ACCUMULO-1171 converted bulk import paths to fully qualified
630cc04474894bdd140c166878aa58168bf78168,ACCUMULO-919,ACCUMULO-919: move recovery files to the trash, too
a649b2fcaa9f7b102c56f41f9f1b154a673fd767,ACCUMULO-1163,ACCUMULO-1163 modify setProperty to throw a NotFound exception if the table is gone from zookeeper by the time we set the property
423eb74574d6e7646b2ba129b841a11532a8711a,ACCUMULO-1161,ACCUMULO-1161 - sed command to update xml files apparently wasn't right, got missed
d946837d57fcc11c62749d86ef8c8ea8a2c854c8,ACCUMULO-1164,ACCUMULO-1164 use cli utilities
6514a41544b418fc9a3f92a08d45c9b209c0cfde,ACCUMULO-1162,ACCUMULO-1162 - WalkingSecurity was being cached, so state initialization in it never happened
e9645e91a04345b482865968b438fc5eddfed0b3,ACCUMULO-1018,ACCUMULO-1018 applied patch from Kevin Faro that adds table info to security exception messages
86e79384c83dd369c06768b72278ad2f34396e09,ACCUMULO-1161,ACCUMULO-1161 - neglected how getPropertiesWithPrefix worked. Also, added some debug info to login tokens
e93a11aa43659bb6bd477a25e367d8510c627cb5,ACCUMULO-1162,ACCUMULO-1162 - Initialization now sets TableUser to non-existant.
1aff95dbe5983f2ab1750047e4d8f351dc46fa1e,ACCUMULO-1141,ACCUMULO-1141 use maxFrameSize
b83e263e03b9452314e33630416ab27d36af4f2d,ACCUMULO-1115,ACCUMULO-1115 catch race condition setting properties on a table that is being deleted
2d5727d11f2e0cf7213573806f45c6682cbf6c8b,ACCUMULO-1123,ACCUMULO-1123 - the same pause after changing password is needed at create user time
4e911d1d6d2200600b01a2a8b79f6cd08bc4a4d5,ACCUMULO-1151,ACCUMULO-1151 - Adding currentTimeMillis() to failure info
3ae2b169d30ad1f39cc50540ddb0eb22321ada5d,ACCUMULO-295,ACCUMULO-295 - shifted TCredentials into all calls instead of the locator itself ACCUMULO-259 - Found some translation misses in mapred.InputFormatBase
b66dfc949caf871aaf8eeef466a4fa4325cdde92,ACCUMULO-1154,ACCUMULO-1154 - a little bit more safety in the scanners and writer to make sure they are cleaned up well
dcadae231f4563cb41c81da8c0eddb0d3884c248,ACCUMULO-1151,ACCUMULO-1151 - better debug on failure
0f6e3c1c309aa6f0f0e051cab46e2ce9be54f819,ACCUMULO-1151,ACCUMULO-1151 - Now dumping state.properties, dumping PasswordToken contents, and spitting out Connector.whoami()
c9130390a7ed1c36bfed41e1927a5716c58a817d,ACCUMULO-1149,ACCUMULO-1149 prevent balancing during tserver shutdown; ensure that tservers with different ids but the same host/port are removed from the shutdown set
5808dfd852ce197ecb62fa399b07cf04d0aec3bb,ACCUMULO-1149,ACCUMULO-1149 prevent balancing during tserver shutdown; ensure that tservers with different ids but the same host/port are removed from the shutdown set
c01a0e5e3fa5852f68dfae9995cffeed20ace655,ACCUMULO-1147,ACCUMULO-1147 remove missing file warning
dac3ed2df61d6ecb388eb2f1db8992c084455837,ACCUMULO-1147,ACCUMULO-1147 remove missing file warning
d03efa143fb81709a840f1a5e2f1d3564c5a6a7a,ACCUMULO-1140,ACCUMULO-1140 display actual number of tservers using precise whole numbers
c35465cfc1d37b7a2cc3ec19baa5638e54fc1f94,ACCUMULO-1104,ACCUMULO-1104 Another update to account for 1.5 changes in the user manual
d53ebc665209dd729ce9c1290df7dd839556eca0,ACCUMULO-1071,ACCUMULO-1071 Changing wording from "hadoop library type" to "Accumulo memory-map type"
f598f0bfe83c34dff6d07f2c59f5d2d2a77e245f,ACCUMULO-1104,ACCUMULO-1104 ACCUMULO-1136 Applying additional wording for using config as opposed to setiter. Fix various other documentation which are now incorrect in 1.5.
456ffb34d1323825e5b82cfbb17dcc96ce24e7e5,ACCUMULO-1104,ACCUMULO-1104 Correcting documented option to show timestamps in shell in user manual.
06e4c53b2ae4a1a0b85411f520c5069bd3aa76fb,ACCUMULO-1118,ACCUMULO-1118 fixed upgrade test script, seems that test and verify ingest now require a username and password
ed5f500b0535435329f04b345d66c7f2d03b7a82,ACCUMULO-1123,ACCUMULO-1123 - pay no mind to the man behind the curtain
4dc39dea130203663fe3953e5eddb600b0017b31,ACCUMULO-1123,ACCUMULO-1123 - minor oversight
b211360ffd624f4772529473b3ed0e9d6b581671,ACCUMULO-1123,ACCUMULO-1123 - Had compensation for propogation times for uncached permissions. Authorizations and passwords didn't have the luxury. Added in transient state for authorizations and a pause for ChangePass to help compensate. Ideally, there would be compensation throughout the code for the password, but the code has already become a bit of a rats nest. WalkingSecurity helped clean it up tremendously, I should rewrite a lot of the states now that that exists to make it simpler.
8593047961ac22068d2ea4cb376fdab557270087,ACCUMULO-1138,ACCUMULO-1138 - syncing before uncached calls and ZKAuthenticator was kicking back the wrong class in getTokenLoginClass
70f65eee3626b117f7023bb582b901861e1b3232,ACCUMULO-1125,merged some bug fixes from 1.5: ACCUMULO-1125 delete distributed work queue task lock when task fails ACCUMULO-1049 modified master to stop locking tserver nodes and just monitor tserver nodes in zookeeper ACCUMULO-954 made zoolock report when its no longer able to monitor lock node and there does not know the status of the lock ACCUMULO-954 Made zoolock rewatch its parent node and added some unit test for zoolock
1a3ba71d261f5cd333255eb9093658ae21435073,ACCUMULO-1038,ACCUMULO-1038 commiting patch provided by Michael Berman
d8af8d80bfc8294e53388efe73fb9fdf1f376b89,ACCUMULO-1038,ACCUMULO-1038 commiting patch provided by Michael Berman
6cd4edc8e4dd582b388b27e1a5a45646f20bf6f9,ACCUMULO-1071,ACCUMULO-1071 - needs to be executable
4c113df757e38775a3e8e18786447bdd7346d668,ACCUMULO-1071,ACCUMULO-1071 fixing syntax error
2f1285a4dd0073a67758ac7b3a3b50cc5f1174be,ACCUMULO-1117,ACCUMULO-1117 do not log a stack trace for a simple communications failure
2af0c8506d0ae63aa4a746dfa015d4ec0d19c2c2,ACCUMULO-1115,ACCUMULO-1115 handle table deleted exception
01679d0767ab7ad4262518e09a757f88c37a5e0f,ACCUMULO-1071,ACCUMULO-1071 committing Damon Brown's patch to clean-up the shell scripts
d2a1f26ce1e5420bd0f62f78a4448bfef2c5966a,ACCUMULO-1071,ACCUMULO-1071 committing Damon Brown's patch to clean-up the shell scripts
d78f05746d7b7062c6bafa3a4633e54594234786,ACCUMULO-1137,ACCUMULO-1137 Set 'accumulo' namespace for c++ bindings
323c94bf4101f138672c93992108a57f39d226ad,ACCUMULO-1126,ACCUMULO-1126 Made AGC clean up unrefed sorted walogs. Also made it delete unrefed walogs of offline servers.
a3dd30eadd1dbad99977df2ae611169d50ade643,ACCUMULO-1110,ACCUMULO-1110 avoid locking the tablet to get file counts
a083012ed08a1d3a64b7431113ebcea7237df02b,ACCUMULO-995,ACCUMULO-995 Applied patch from Michael Allen that fixes passing options to stop-all.sh
d3752d6c08f9bef1918532a440429afbc6e9c9a7,ACCUMULO-1125,ACCUMULO-1125 delete distributed work queue task lock when task fails
872e8fdd7d4dd5545a68f93012fb00b04ca9ebd0,ACCUMULO-1077,ACCUMULO-1077 fixed deadlock w/ walog recovery and made walog recovery retry w/ backoff.... failed log recoveries were not retrying
87df5f68e2e29a6ff0445f08dca6be9dc65c6039,ACCUMULO-1077,ACCUMULO-1077 fixed deadlock w/ walog recovery and made walog recovery retry w/ backoff.... failed log recoveries were not retrying
cdd169b9c7dc59856827f9ed3e56e324a9a3ee04,ACCUMULO-1086,ACCUMULO-1086 require some user auth, and filter out passwords
abaa4eab7940d51455b63008f081ac7b340c0644,ACCUMULO-1086,ACCUMULO-1086 require some user auth, and filter out passwords
922749630c8880dccce653fc39d6d43fa5528835,ACCUMULO-919,ACCUMULO-919 port the Trash updates back to 1.4
474b2577afc13e352a3a455066da6e5d161d2b6c,ACCUMULO-1120,ACCUMULO-1120 - credentials now getting properly read
888d5b6dc2c9e06b41792aa2ae2242d9a21bce28,ACCUMULO-1114,ACCUMULO-1114 store token for root, not serialized bytes
b36e0d326af903f2a5dd2a9718752e2eee7c6bec,ACCUMULO-1114,ACCUMULO-1114 store token for root, not serialized bytes
a1a7380b1d16bb59d4084a7a95237efd1bee05fd,ACCUMULO-1118,ACCUMULO-1118 reverting change that breaks "admin stop"
da7b69e321757b61f215001bed8fdc0c5731bf51,ACCUMULO-1118,ACCUMULO-1118 reverting inadvertent commits
729ed59186097b1ae93bbb32bef118abf5d1b83a,ACCUMULO-1118,ACCUMULO-1118 reverting change that breaks "admin stop"
bf2a9ea8f0f632c38b8a8621636fc10261ef96fc,ACCUMULO-1118,ACCUMULO-1118 reverting change that breaks "admin stop"
407cd49149a6c208f372eaf09f7b5b7335565a49,ACCUMULO-858,ACCUMULO-858: Parse Exception During Run of Maven Changes Report Plugin
086cd0a8fbc720c6f17c1c6e24a753283bad6ef3,ACCUMULO-1104,ACCUMULO-1104, ACCUMULO-1093, ACCUMULO-1094, ACCUMULO-1095, ACCUMULO-1099, ACCUMULO-1097, ACCUMULO-1102 - Improve documentation
a446b0aa0c709534fe57f517c2d2d9b72096a679,ACCUMULO-338,ACCUMULO-338 - Committing Chris McCubbin's patch, with some updated usage information.
2f1c948799917c967e36b48f46f322af7af56009,ACCUMULO-1118,ACCUMULO-1118 - updating cli's default password to be empty, and some of the tests appropriately
1d5a4f6153521a38d01c2395fc79e4256b843dae,ACCUMULO-1118,ACCUMULO-1118 - updating cli's default password to be empty, and some of the tests appropriately
64e122d6235b8093e89e4a06ebeddb6fb7bef381,ACCUMULO-1114,ACCUMULO-1114 a partial fix for user/table password handling
551504b77267a0d80f18eda14c0f9b49a1b81f0b,ACCUMULO-1114,ACCUMULO-1114 improve message reporting
bba2d8864e3871b00618958f5a8b7ed4157d1f96,ACCUMULO-1112,ACCUMULO-1112 allow the master to transition from UNLOAD_METADATA_TABLE to NORMAL
4ec727762f56e6fe6d5af0bbba2101519cad3f07,ACCUMULO-1115,ACCUMULO-1115 double check for table existence and use the proper keys to pull state
106f1df045ab7fa77a07b2029d825135b261eaf2,ACCUMULO-1111,ACCUMULO-1111 - fixed infinite loops clobering the stack
4b123c413a3f98b414a0c4caf233a2dac17c642e,ACCUMULO-1044,ACCUMULO-1044 properly extract a column qualifier as a string
3cb9c8314cec0b080f5f086237c9daf0376ed1fb,ACCUMULO-1044,ACCUMULO-1044 properly extract a column qualifier as a string
6c648a38001b9915e4d0c0241dcba645622e7c35,ACCUMULO-1105,ACCUMULO-1105 more issues with random walk tests
65d8218a77093da23a5ece42f046c43958d53f0e,ACCUMULO-1105,ACCUMULO-1105 found many bad refactorings of the authentication stuff
1b2b9fd9791d136409957783ca77c7f2973423fa,ACCUMULO-1105,ACCUMULO-1105 found a bad refactor of the authentication stuff in RW tests
74a1858028635183750a5f0e9ff2d59c1dbe0e01,ACCUMULO-1088,ACCUMULO-1088 when new tservers a noticed, remove any matching bad server information
57659188cc309cc6e8819624a656ac7de78de3fb,ACCUMULO-1053,ACCUMULO-1053 propogate exceptions only if append approach to lease recovery fails
a9d3bf2264aaf69cea657e7092e53df92eaecf05,ACCUMULO-1053,ACCUMULO-1053 allow I/O exceptions to propagate out to FATE
b2465341f71f229ee6f1aebf436dce8b1e6624cf,ACCUMULO-1081,ACCUMULO-1081 Add a dependency to commons-math for the configuration randomwalk tests
9c397eaffd1eab9ad071853dcfce053539c2f3aa,ACCUMULO-1051,ACCUMULO-1051 checking in patch from Kevin Faro
a251611ecb5f9b07f99ad02bf9e0242d79cb5421,ACCUMULO-1053,ACCUMULO-1053 pull simplified Repo from trunk
a43610157405416071a89bac34cfdb16385cce65,ACCUMULO-1053,ACCUMULO-1053 force logger to write something before attempting recursive defineTablet flushes
c122f2153c7b8a0d9b1e3af7aa81e3dbb07c416f,ACCUMULO-1053,ACCUMULO-1053 handle unexpected file system types
b116917e28a40d6c09fa80e90f86d7b50e62902d,ACCUMULO-1053,ACCUMULO-1053 revert inadvertent version change
7330cd4a4e271ac776a9321e68aec8ea2261321f,ACCUMULO-1053,ACCUMULO-1053 revert inadvertent version change
55d673e2e28c5f50653a1b1a08c607bf87703f91,ACCUMULO-1053,ACCUMULO-1053 merge inadvertent commit in trunk back to 1.5 branch
c311c467af65989d4d56da033904ae38f0790cf5,ACCUMULO-1053,ACCUMULO-1053 let file-not-found errors propagate and fail the FATE operation
12c0b1c63ddb1d33edf1d5cfdea9bb6d36f4cfbd,ACCUMULO-1053,ACCUMULO-1053 move lease recovery check to isReady()
af24fd754adbe1f68d3e077df5656a4bfd91eaed,ACCUMULO-1053,ACCUMULO-1053 wait until a file has been closed before using it for recovery
9b5ec6cf6c355d9fd8325cfa45c1b34ae84069a9,ACCUMULO-919,ACCUMULO-919 use the trash to cleanup root tablet files, recovery files, and WAL
806fda126cadd6cd33575d8a71436c6fb2fd7067,ACCUMULO-1062,ACCUMULO-1062 2000 threads is a little too much for a unit test; merge to 1.4 branch
134015c34041cf7b4770759d0d1e2edd9c7bcc80,ACCUMULO-1062,ACCUMULO-1062 2000 threads is a little too much for a unit test
25cf3ccde8f1250df5bd7a848842abea6c0450a3,ACCUMULO-1051,ACCUMULO-1051 reverted previous change, which broke unit tests. Awaiting updated patch based on test failures and ticket discussions.
b36658e5656da05e6ba2f948e66aebc822a9dab4,ACCUMULO-1051,ACCUMULO-1051 Applied patch from Kevin Faro ([~kevin.faro]) to consistently serialize Authorizations
16ab73baae98e565cef83eaa8610a47349d830c2,ACCUMULO-1062,ACCUMULO-1062 serialize writes to ensure counts, rather than serializing the return using check/notify for counts; merge to 1.4 branch
365dfe3161e4d4a7a954962be6e2ada38de10dba,ACCUMULO-1062,ACCUMULO-1062 serialize writes to ensure counts, rather than serializing the return using check/notify for counts
